query	volume	landing_url	page_type	matched_dimensions	matched_values	source_file
промт для создания фото	12852	/promty-dlya-sozdaniya-foto/	static_hub	intent_action=sozdanie	intent_action=sozdanie	wordstat_top_queries (1).csv
промт для генерации фото	10998	/promty-dlya-sozdaniya-foto/	static_hub	intent_action=sozdanie	intent_action=sozdanie	wordstat_top_queries (1).csv
промты для фото девушки	7435	/promty-dlya-foto-devushki/	programmatic_L1	audience_tag	devushka	wordstat_top_queries (1).csv
промт для обработки фото	6190	/promty-dlya-obrabotki-foto/	static_hub	intent_action=obrabotka	intent_action=obrabotka	wordstat_top_queries (1).csv
промты для фото мужчины	3611	/promty-dlya-foto-muzhchiny/	programmatic_L1	audience_tag	muzhchina	wordstat_top_queries (1).csv
промты для фото пар	2754	/promty-dlya-foto-par/	programmatic_L1	audience_tag	para	wordstat_top_queries (1).csv
промт для семейного фото	2392	/promty-dlya-semejnogo-foto/	programmatic_L1	audience_tag	semya	wordstat_top_queries (1).csv
промт для улучшения фото	2349	/promty-dlya-uluchsheniya-foto/	static_hub	intent_action=uluchshenie	intent_action=uluchshenie	wordstat_top_queries (1).csv
промты для фото женщины	2242	/promty-dlya-foto-devushki/	programmatic_L1	audience_tag	devushka	wordstat_top_queries (1).csv
промт для фото на день рождения	2149	/sobytiya/den-rozhdeniya/	programmatic_L1	occasion_tag	den_rozhdeniya	wordstat_top_queries (1).csv
промт черно белое фото	2130	/stil/cherno-beloe/	programmatic_L1	style_tag	cherno_beloe	wordstat_top_queries (1).csv
создать промт по фото	1930	/promty-dlya-sozdaniya-foto/	static_hub	intent_action=sozdanie	intent_action=sozdanie	wordstat_top_queries (1).csv
промты для парных фото	1791	/promty-dlya-foto-par/	programmatic_L1	audience_tag	para	wordstat_top_queries (1).csv
реалистичные промты для фото	1696	/stil/realistichnoe/	programmatic_L1	style_tag	realistichnoe	wordstat_top_queries (1).csv
промты для нейросети для обработки фото	1674	/promty-dlya-obrabotki-foto/	static_hub	intent_action=obrabotka	intent_action=obrabotka	wordstat_top_queries (1).csv
промты для детских фото	1629	/promty-dlya-detskih-foto/	programmatic_L1	audience_tag	detskie	wordstat_top_queries (1).csv
промт для улучшения качества фото	1616	/promty-dlya-uluchsheniya-foto/	static_hub	intent_action=uluchshenie	intent_action=uluchshenie	wordstat_top_queries (1).csv
промт для фото мужской	1614	/promty-dlya-foto-muzhchiny/	programmatic_L1	audience_tag	muzhchina	wordstat_top_queries (1).csv
промт для ии для создания фото	1610	/promty-dlya-sozdaniya-foto/	static_hub	intent_action=sozdanie	intent_action=sozdanie	wordstat_top_queries (1).csv
промт для фото на 23 февраля	1576	/sobytiya/23-fevralya/	programmatic_L1	occasion_tag	23_fevralya	wordstat_top_queries (1).csv
промт для фото с ребенком	1529	/promty-dlya-detskih-foto/	programmatic_L1	audience_tag	detskie	wordstat_top_queries (1).csv
промт для фото на паспорт	1483	/foto-na-pasport/	programmatic_L1	doc_task_tag	na_pasport	wordstat_top_queries (1).csv
сделать фото ии промт	1226	/promty-dlya-sozdaniya-foto/	static_hub	intent_action=sozdanie	intent_action=sozdanie	wordstat_top_queries (1).csv
промт для старых фото	1207	/promty-dlya-restavracii-foto/	static_hub	intent_action=restavratsiya	intent_action=restavratsiya	wordstat_top_queries (1).csv
промты для изменения фото	1198	/promty-dlya-obrabotki-foto/	static_hub	intent_action=obrabotka	intent_action=obrabotka	wordstat_top_queries (1).csv
сделать промт по фото	1196	/promty-dlya-sozdaniya-foto/	static_hub	intent_action=sozdanie	intent_action=sozdanie	wordstat_top_queries (1).csv
промт для фото фотосессия	1184	/promty-dlya-fotosessii/	static_hub	intent_action=fotosessiya	intent_action=fotosessiya	wordstat_top_queries (1).csv
промт для фото с мамой	1155	/promty-dlya-foto-s-mamoy/	programmatic_L1	audience_tag	s_mamoy	wordstat_top_queries (1).csv
промт для фото с парнем	1087	/promty-dlya-foto-s-parnem/	programmatic_L1	audience_tag	s_parnem	wordstat_top_queries (1).csv
промт для редактирования фото	1065	/promty-dlya-obrabotki-foto/	static_hub	intent_action=obrabotka	intent_action=obrabotka	wordstat_top_queries (1).csv
промт для фото портрета	1063	/stil/portret/	programmatic_L1	style_tag	portret	wordstat_top_queries (1).csv
промты для фото женские	955	/promty-dlya-foto-devushki/	programmatic_L1	audience_tag	devushka	wordstat_top_queries (1).csv
промты для фото с машиной	921	/s-mashinoy/	programmatic_L1	object_tag	s_mashinoy	wordstat_top_queries (1).csv
промты фото девушек нейросетей	920	/promty-dlya-foto-devushki/	programmatic_L1	audience_tag	devushka	wordstat_top_queries (1).csv
подробный промт для генерации фото	907	/promty-dlya-sozdaniya-foto/	static_hub	intent_action=sozdanie	intent_action=sozdanie	wordstat_top_queries (1).csv
промты для совместных фото	903	/promty-dlya-foto-par/	programmatic_L1	audience_tag	para	wordstat_top_queries (1).csv
промт для студийного фото	873	/stil/studiynoe/	programmatic_L1	style_tag	studiynoe	wordstat_top_queries (1).csv
промт для фото поколений	872	/promty-dlya-foto-pokoleniy/	programmatic_L1	audience_tag	pokoleniy	wordstat_top_queries (1).csv
промты для ии для фото девушки	834	/promty-dlya-foto-devushki/	programmatic_L1	audience_tag	devushka	wordstat_top_queries (1).csv
промт для фото семьи	829	/promty-dlya-semejnogo-foto/	programmatic_L1	audience_tag	semya	wordstat_top_queries (1).csv
промты для генерации фото девушки	826	/promty-dlya-foto-devushki/	programmatic_L1	audience_tag	devushka	wordstat_top_queries (1).csv
промт для фото девочки	788	/promty-dlya-foto-devochki/	programmatic_L1	audience_tag	devochka	wordstat_top_queries (1).csv
промт для генерации фото примеры	781	/promty-dlya-sozdaniya-foto/	static_hub	intent_action=sozdanie	intent_action=sozdanie	wordstat_top_queries (1).csv
промт для фото на 8 марта	777	/sobytiya/8-marta/	programmatic_L1	occasion_tag	8_marta	wordstat_top_queries (1).csv
промт фото друзья	734	/promty-dlya-foto-s-drugom/	programmatic_L1	audience_tag	s_drugom	wordstat_top_queries (1).csv
промт для создания фото девушки	703	/promty-dlya-foto-devushki/	programmatic_L1	audience_tag	devushka	wordstat_top_queries (1).csv
промт для фото на 14 февраля	692	/sobytiya/14-fevralya/	programmatic_L1	occasion_tag	14_fevralya	wordstat_top_queries (1).csv
промт ии парное фото фото	690	/promty-dlya-foto-par/	programmatic_L1	audience_tag	para	wordstat_top_queries (1).csv
промт для делового фото	672	/stil/delovoe/	programmatic_L1	style_tag	delovoe	wordstat_top_queries (1).csv
промт для фото в стиле гта	667	/stil/gta/	programmatic_L1	style_tag	gta	wordstat_top_queries (1).csv
промт для фото с военным	665	/v-forme/	programmatic_L1	object_tag	v_forme	wordstat_top_queries (1).csv
готовые промты для обработки фото	646	/promty-dlya-obrabotki-foto/	static_hub	intent_action=obrabotka	intent_action=obrabotka	wordstat_top_queries (1).csv
промты для фото мальчика	645	/promty-dlya-foto-malchika/	programmatic_L1	audience_tag	malchik	wordstat_top_queries (1).csv
промт для фото с цветами	641	/s-cvetami/	programmatic_L1	object_tag	s_cvetami	wordstat_top_queries (1).csv
промт улучшить фото	638	/promty-dlya-uluchsheniya-foto/	static_hub	intent_action=uluchshenie	intent_action=uluchshenie	wordstat_top_queries (1).csv
промт для фото love is	632	/stil/love-is/	programmatic_L1	style_tag	love_is	wordstat_top_queries (1).csv
промт для фото в костюме	623	/v-kostyume/	programmatic_L1	object_tag	v_kostyume	wordstat_top_queries (1).csv
промт для gpt обработка фото	622	/promty-dlya-obrabotki-foto/	static_hub	intent_action=obrabotka	intent_action=obrabotka	wordstat_top_queries (1).csv
промты для генерации изображений по фото	622	/promty-dlya-sozdaniya-foto/	static_hub	intent_action=sozdanie	intent_action=sozdanie	wordstat_top_queries (1).csv
промт для фото со знаменитостью	586	/so-znamenitostyu/	programmatic_L1	object_tag	so_znamenitostyu	wordstat_top_queries (1).csv
промт для фото с подругой	584	/promty-dlya-foto-s-podrugoy/	programmatic_L1	audience_tag	s_podrugoy	wordstat_top_queries (1).csv
промт для фото в форме	576	/v-forme/	programmatic_L1	object_tag	v_forme	wordstat_top_queries (1).csv
фото для пар ии промты	567	/promty-dlya-foto-par/	programmatic_L1	audience_tag	para	wordstat_top_queries (1).csv
готовые промты для генерации фото	566	/promty-dlya-sozdaniya-foto/	static_hub	intent_action=sozdanie	intent_action=sozdanie	wordstat_top_queries (1).csv
промт для ии для обработки фото	565	/promty-dlya-obrabotki-foto/	static_hub	intent_action=obrabotka	intent_action=obrabotka	wordstat_top_queries (1).csv
промт для весеннего фото	555	/vesennie/	programmatic_L1	object_tag	vesna	wordstat_top_queries (1).csv
промт на фото с тортом	540	/s-tortom/	programmatic_L1	object_tag	s_tortom	wordstat_top_queries (1).csv
промты для фото с мужем	539	/promty-dlya-foto-s-muzhem/	programmatic_L1	audience_tag	s_muzhem	wordstat_top_queries (1).csv
промты для фото с другом	532	/promty-dlya-foto-s-drugom/	programmatic_L1	audience_tag	s_drugom	wordstat_top_queries (1).csv
промт для фото влюбленных	529	/promty-dlya-foto-vlyublennykh/	programmatic_L1	audience_tag	vlyublennykh	wordstat_top_queries (1).csv
промт для фото с собакой	526	/s-sobakoj/	programmatic_L1	object_tag	s_sobakoy	wordstat_top_queries (1).csv
промт для портретного фото	515	/stil/portret/	programmatic_L1	style_tag	portret	wordstat_top_queries (1).csv
промт для фото в профиль	511	/v-profil/	programmatic_L1	object_tag	v_profil	wordstat_top_queries (1).csv
промт для фото на масленицу	509	/sobytiya/maslenica/	programmatic_L1	occasion_tag	maslenica	wordstat_top_queries (1).csv
промт для ии фото мужчины	471	/promty-dlya-foto-muzhchiny/	programmatic_L1	audience_tag	muzhchina	wordstat_top_queries (1).csv
создать промт по фото бесплатно	455	/promty-dlya-sozdaniya-foto/	static_hub	intent_action=sozdanie	intent_action=sozdanie	wordstat_top_queries (1).csv
промты для нейросети для обработки фото готовые	454	/promty-dlya-obrabotki-foto/	static_hub	intent_action=obrabotka	intent_action=obrabotka	wordstat_top_queries (1).csv
промт для создания фото в нейросети	452	/promty-dlya-sozdaniya-foto/	static_hub	intent_action=sozdanie	intent_action=sozdanie	wordstat_top_queries (1).csv
подробный промт для создания фото	448	/promty-dlya-sozdaniya-foto/	static_hub	intent_action=sozdanie	intent_action=sozdanie	wordstat_top_queries (1).csv
промт фото девушки и парня	444	/promty-dlya-foto-devushki/	programmatic_L1	audience_tag	devushka	wordstat_top_queries (1).csv
сгенерировать фото по промту	443	/promty-dlya-sozdaniya-foto/	static_hub	intent_action=sozdanie	intent_action=sozdanie	wordstat_top_queries (1).csv
промт для фото бабушки	442	/promty-dlya-foto-s-babushkoy/	programmatic_L1	audience_tag	s_babushkoy	wordstat_top_queries (1).csv
промт для реставрации фото	438	/promty-dlya-restavracii-foto/	static_hub	intent_action=restavratsiya	intent_action=restavratsiya	wordstat_top_queries (1).csv
промт для фото в зеркале	433	/v-zerkale/	programmatic_L1	object_tag	v_zerkale	wordstat_top_queries (1).csv
промт для создания фото примеры	429	/promty-dlya-sozdaniya-foto/	static_hub	intent_action=sozdanie	intent_action=sozdanie	wordstat_top_queries (1).csv
советское фото промт	422	/stil/sovetskoe/	programmatic_L1	style_tag	sovetskoe	wordstat_top_queries (1).csv
промт для свадебного фото	412	/sobytiya/svadba/	programmatic_L1	occasion_tag	svadba	wordstat_top_queries (1).csv
промт на фото гта	409	/stil/gta/	programmatic_L1	style_tag	gta	wordstat_top_queries (1).csv
промт для фото с питомцем	406	/promty-dlya-foto-s-pitomcem/	programmatic_L1	audience_tag	s_pitomcem	wordstat_top_queries (1).csv
промт для фото мамы с ребенком	406	/promty-dlya-detskih-foto/	programmatic_L1	audience_tag	detskie	wordstat_top_queries (1).csv
промт для создания реалистичного фото	403	/stil/realistichnoe/	programmatic_L1	style_tag	realistichnoe	wordstat_top_queries (1).csv
пример промта для фото девушки	396	/promty-dlya-foto-devushki/	programmatic_L1	audience_tag	devushka	wordstat_top_queries (1).csv
промт на день рождения с детским фото	390	/promty-dlya-detskih-foto/den-rozhdeniya/	programmatic_L2	audience_tag+occasion_tag	detskie+den_rozhdeniya	wordstat_top_queries (1).csv
промт для фото с сыном	384	/promty-dlya-foto-s-synom/	programmatic_L1	audience_tag	s_synom	wordstat_top_queries (1).csv
промт для ретуши фото	376	/promty-dlya-obrabotki-foto/	static_hub	intent_action=obrabotka	intent_action=obrabotka	wordstat_top_queries (1).csv
промты для фото ии мужские	373	/promty-dlya-foto-muzhchiny/	programmatic_L1	audience_tag	muzhchina	wordstat_top_queries (1).csv
промт для фото в стиле love is	371	/stil/love-is/	programmatic_L1	style_tag	love_is	wordstat_top_queries (1).csv
промт для обработки фото в стиле	370	/promty-dlya-obrabotki-foto/	static_hub	intent_action=obrabotka	intent_action=obrabotka	wordstat_top_queries (1).csv
промт для фото в студии	366	/stil/studiynoe/	programmatic_L1	style_tag	studiynoe	wordstat_top_queries (1).csv
промт для обработки фото примеры	364	/promty-dlya-obrabotki-foto/	static_hub	intent_action=obrabotka	intent_action=obrabotka	wordstat_top_queries (1).csv
промт для фото нейросети для пар	359	/promty-dlya-foto-par/	programmatic_L1	audience_tag	para	wordstat_top_queries (1).csv
промт для ии семейное фото	355	/promty-dlya-semejnogo-foto/	programmatic_L1	audience_tag	semya	wordstat_top_queries (1).csv
промт для фото на документы	349	/foto-na-dokumenty/	programmatic_L1	doc_task_tag	na_dokumenty	wordstat_top_queries (1).csv
промт для красивого фото девушки	347	/promty-dlya-foto-devushki/	programmatic_L1	audience_tag	devushka	wordstat_top_queries (1).csv
промт для создания фото мужчины	344	/promty-dlya-foto-muzhchiny/	programmatic_L1	audience_tag	muzhchina	wordstat_top_queries (1).csv
промты для генерации фото в нейросетях	344	/promty-dlya-sozdaniya-foto/	static_hub	intent_action=sozdanie	intent_action=sozdanie	wordstat_top_queries (1).csv
ии промты для фото 23 февраля	341	/sobytiya/23-fevralya/	programmatic_L1	occasion_tag	23_fevralya	wordstat_top_queries (1).csv
промт для фото мужчины и женщины	334	/promty-dlya-foto-devushki/	programmatic_L1	audience_tag	devushka	wordstat_top_queries (1).csv
промт для фото полароид	333	/stil/polaroid/	programmatic_L1	style_tag	polaroid	wordstat_top_queries (1).csv
промт для фото автомобиля	330	/s-mashinoy/	programmatic_L1	object_tag	s_mashinoy	wordstat_top_queries (1).csv
промт фото с дочерью	330	/promty-dlya-foto-s-dochkoy/	programmatic_L1	audience_tag	s_dochkoy	wordstat_top_queries (1).csv
промт на объединение фото	327	/promty-dlya-kollazha/	static_hub	intent_action=kollazh	intent_action=kollazh	wordstat_top_queries (1).csv
промт для фото без изменения лица	326	/promty-dlya-obrabotki-foto/	static_hub	intent_action=obrabotka	intent_action=obrabotka	wordstat_top_queries (1).csv
промты для детских фото ии	325	/promty-dlya-detskih-foto/	programmatic_L1	audience_tag	detskie	wordstat_top_queries (1).csv
промт для фото с папой	324	/promty-dlya-foto-s-papoy/	programmatic_L1	audience_tag	s_papoy	wordstat_top_queries (1).csv
ретро фото промт	324	/stil/retro/	programmatic_L1	style_tag	retro	wordstat_top_queries (1).csv
промт для генерации фото на русском	323	/promty-dlya-sozdaniya-foto/	static_hub	intent_action=sozdanie	intent_action=sozdanie	wordstat_top_queries (1).csv
промт для ии фото на паспорт	320	/foto-na-pasport/	programmatic_L1	doc_task_tag	na_pasport	wordstat_top_queries (1).csv
промт объединить фото	320	/promty-dlya-kollazha/	static_hub	intent_action=kollazh	intent_action=kollazh	wordstat_top_queries (1).csv
промт для фото с букетом	318	/s-cvetami/	programmatic_L1	object_tag	s_cvetami	wordstat_top_queries (1).csv
генерация фото по промту бесплатно	317	/promty-dlya-sozdaniya-foto/	static_hub	intent_action=sozdanie	intent_action=sozdanie	wordstat_top_queries (1).csv
промт для фото с котом	316	/s-kotom/	programmatic_L1	object_tag	s_kotom	wordstat_top_queries (1).csv
промт для чата gpt на создание фото	308	/promty-dlya-sozdaniya-foto/	static_hub	intent_action=sozdanie	intent_action=sozdanie	wordstat_top_queries (1).csv
промт для фото с путиным	304	/so-znamenitostyu/	programmatic_L1	object_tag	so_znamenitostyu	wordstat_top_queries (1).csv
создать промт по фото онлайн	302	/promty-dlya-sozdaniya-foto/	static_hub	intent_action=sozdanie	intent_action=sozdanie	wordstat_top_queries (1).csv
промт для фото с дочкой	301	/promty-dlya-foto-s-dochkoy/	programmatic_L1	audience_tag	s_dochkoy	wordstat_top_queries (1).csv
промт для фото мамы и сына	299	/promty-dlya-foto-s-mamoy/	programmatic_L1	audience_tag	s_mamoy	wordstat_top_queries (1).csv
промт для фото с тюльпанами	293	/s-cvetami/	programmatic_L1	object_tag	s_cvetami	wordstat_top_queries (1).csv
промт для ии фото на день рождения	293	/sobytiya/den-rozhdeniya/	programmatic_L1	occasion_tag	den_rozhdeniya	wordstat_top_queries (1).csv
готовые промты для создания фото	282	/promty-dlya-sozdaniya-foto/	static_hub	intent_action=sozdanie	intent_action=sozdanie	wordstat_top_queries (1).csv
промты для чата gpt для обработки фото	281	/promty-dlya-obrabotki-foto/	static_hub	intent_action=obrabotka	intent_action=obrabotka	wordstat_top_queries (1).csv
промт для генерации фото для мужчин	277	/promty-dlya-foto-muzhchiny/	programmatic_L1	audience_tag	muzhchina	wordstat_top_queries (1).csv
промт фото в стиле открытки	276	/stil/otkrytka/	programmatic_L1	style_tag	otkrytka	wordstat_top_queries (1).csv
промт для обработки фото chatgpt	275	/promty-dlya-obrabotki-foto/	static_hub	intent_action=obrabotka	intent_action=obrabotka	wordstat_top_queries (1).csv
промт для фото на день рождения девушке	273	/promty-dlya-foto-devushki/den-rozhdeniya/	programmatic_L2	audience_tag+occasion_tag	devushka+den_rozhdeniya	wordstat_top_queries (1).csv
промт для фото в военной форме	271	/v-forme/	programmatic_L1	object_tag	v_forme	wordstat_top_queries (1).csv
промт для аниме фото	267	/stil/anime/	programmatic_L1	style_tag	anime	wordstat_top_queries (1).csv
промты для фото селфи	263	/stil/selfi/	programmatic_L1	style_tag	selfi	wordstat_top_queries (1).csv
промт для фото в лесу	257	/v-lesu/	programmatic_L1	object_tag	v_lesu	wordstat_top_queries (1).csv
промт для восстановления фото	257	/promty-dlya-restavracii-foto/	static_hub	intent_action=restavratsiya	intent_action=restavratsiya	wordstat_top_queries (1).csv
промт для фото авто	255	/s-mashinoy/	programmatic_L1	object_tag	s_mashinoy	wordstat_top_queries (1).csv
промт на чб фото	253	/stil/cherno-beloe/	programmatic_L1	style_tag	cherno_beloe	wordstat_top_queries (1).csv
промты для создания фото в gpt	246	/promty-dlya-sozdaniya-foto/	static_hub	intent_action=sozdanie	intent_action=sozdanie	wordstat_top_queries (1).csv
промт для фото на аватарку	244	/foto-na-avatarku/	programmatic_L1	doc_task_tag	na_avatarku	wordstat_top_queries (1).csv
промт для фото нейросети мужчина	244	/promty-dlya-foto-muzhchiny/	programmatic_L1	audience_tag	muzhchina	wordstat_top_queries (1).csv
промт для создания фото на день рождения	244	/sobytiya/den-rozhdeniya/	programmatic_L1	occasion_tag	den_rozhdeniya	wordstat_top_queries (1).csv
промты для нейросети для обработки фото примеры	243	/promty-dlya-obrabotki-foto/	static_hub	intent_action=obrabotka	intent_action=obrabotka	wordstat_top_queries (1).csv
промт на зимнее фото	240	/zimnie/	programmatic_L1	object_tag	zima	wordstat_top_queries (1).csv
промт для создания семейного фото	239	/promty-dlya-semejnogo-foto/	programmatic_L1	audience_tag	semya	wordstat_top_queries (1).csv
промт фото девушки в платье	236	/promty-dlya-foto-devushki/	programmatic_L1	audience_tag	devushka	wordstat_top_queries (1).csv
промты для фото малышей	236	/promty-dlya-foto-malysha/	programmatic_L1	audience_tag	malysh	wordstat_top_queries (1).csv
промты для ии фото с парнем	234	/promty-dlya-foto-s-parnem/	programmatic_L1	audience_tag	s_parnem	wordstat_top_queries (1).csv
промт для фото сво	233	/v-forme/	programmatic_L1	object_tag	v_forme	wordstat_top_queries (1).csv
промт фото фоне детского фото	225	/promty-dlya-detskih-foto/	programmatic_L1	audience_tag	detskie	wordstat_top_queries (1).csv
промт на мультяшное фото	224	/stil/multyashnoe/	programmatic_L1	style_tag	multyashnoe	wordstat_top_queries (1).csv
промт для создания красивого фото	224	/promty-dlya-sozdaniya-foto/	static_hub	intent_action=sozdanie	intent_action=sozdanie	wordstat_top_queries (1).csv
промт для создания похожего фото	224	/promty-dlya-sozdaniya-foto/	static_hub	intent_action=sozdanie	intent_action=sozdanie	wordstat_top_queries (1).csv
промт для создания фото пар	223	/promty-dlya-foto-par/	programmatic_L1	audience_tag	para	wordstat_top_queries (1).csv
промт для создания фото пары	223	/promty-dlya-sozdaniya-foto/	static_hub	intent_action=sozdanie	intent_action=sozdanie	wordstat_top_queries (1).csv
промты для парных фото в ии	222	/promty-dlya-foto-par/	programmatic_L1	audience_tag	para	wordstat_top_queries (1).csv
промт для фото двоих	221	/promty-dlya-foto-par/	programmatic_L1	audience_tag	para	wordstat_top_queries (1).csv
промт для реставрации старых фото	221	/promty-dlya-restavracii-foto/	static_hub	intent_action=restavratsiya	intent_action=restavratsiya	wordstat_top_queries (1).csv
винтажное фото промт	220	/stil/retro/	programmatic_L1	style_tag	retro	wordstat_top_queries (1).csv
черно белое фото ии промт	219	/stil/cherno-beloe/	programmatic_L1	style_tag	cherno_beloe	wordstat_top_queries (1).csv
промт для создания фото женщины	219	/promty-dlya-foto-devushki/	programmatic_L1	audience_tag	devushka	wordstat_top_queries (1).csv
промты для фото в нейросети женские	219	/promty-dlya-foto-devushki/	programmatic_L1	audience_tag	devushka	wordstat_top_queries (1).csv
промт для ии фото с ребенком	215	/promty-dlya-detskih-foto/	programmatic_L1	audience_tag	detskie	wordstat_top_queries (1).csv
промт для фото в деловом стиле	215	/stil/delovoe/	programmatic_L1	style_tag	delovoe	wordstat_top_queries (1).csv
промт для фото на др	213	/sobytiya/den-rozhdeniya/	programmatic_L1	occasion_tag	den_rozhdeniya	wordstat_top_queries (1).csv
промты для обработки фото на русском	213	/promty-dlya-obrabotki-foto/	static_hub	intent_action=obrabotka	intent_action=obrabotka	wordstat_top_queries (1).csv
