query	volume	landing_url	page_type	matched_dimensions	matched_values	source_file
промт для портретного фото мужчины	19	/promty-dlya-foto-muzhchiny/portret/	programmatic_L2	audience_tag+style_tag	muzhchina+portret	wordstat_top_queries (1).csv
варианты промтов для создания фото	19	/promty-dlya-sozdaniya-foto/	static_hub	intent_action=sozdanie	intent_action=sozdanie	wordstat_top_queries (1).csv
промт для создания фото с подругой	19	/promty-dlya-foto-s-podrugoy/	programmatic_L1	audience_tag	s_podrugoy	wordstat_top_queries (1).csv
промты для генерации фото мастера маникюра	19	/promty-dlya-sozdaniya-foto/	static_hub	intent_action=sozdanie	intent_action=sozdanie	wordstat_top_queries (1).csv
создать промт по фото приложения	19	/promty-dlya-sozdaniya-foto/	static_hub	intent_action=sozdanie	intent_action=sozdanie	wordstat_top_queries (1).csv
промты для генерации свадебных фото	19	/sobytiya/svadba/	programmatic_L1	occasion_tag	svadba	wordstat_top_queries (1).csv
промт чтобы сделать фото на документы	19	/foto-na-dokumenty/	programmatic_L1	doc_task_tag	na_dokumenty	wordstat_top_queries (1).csv
промт для изменения размера фото	19	/promty-dlya-obrabotki-foto/	static_hub	intent_action=obrabotka	intent_action=obrabotka	wordstat_top_queries (1).csv
промт для фото пожилой женщины	19	/promty-dlya-foto-devushki/	programmatic_L1	audience_tag	devushka	wordstat_top_queries (1).csv
детальный промт для создания фото изображения	19	/promty-dlya-sozdaniya-foto/	static_hub	intent_action=sozdanie	intent_action=sozdanie	wordstat_top_queries (1).csv
промты для генерации фото nana banana	19	/promty-dlya-sozdaniya-foto/	static_hub	intent_action=sozdanie	intent_action=sozdanie	wordstat_top_queries (1).csv
промт для создания советской открытки из фото	19	/stil/otkrytka/	programmatic_L1	style_tag	otkrytka	wordstat_top_queries (1).csv
промт для пар реалистичные фото	18	/promty-dlya-foto-par/realistichnoe/	programmatic_L2	audience_tag+style_tag	para+realistichnoe	wordstat_top_queries (1).csv
промт для реалистичной фото пары	18	/stil/realistichnoe/	programmatic_L1	style_tag	realistichnoe	wordstat_top_queries (1).csv
промт для генерации фото с кольцами	18	/promty-dlya-sozdaniya-foto/	static_hub	intent_action=sozdanie	intent_action=sozdanie	wordstat_top_queries (1).csv
промты для крутых фото авто	18	/s-mashinoy/	programmatic_L1	object_tag	s_mashinoy	wordstat_top_queries (1).csv
промт для улучшения фото примеры	18	/promty-dlya-uluchsheniya-foto/	static_hub	intent_action=uluchshenie	intent_action=uluchshenie	wordstat_top_queries (1).csv
промт для создания красивых фото в ии	18	/promty-dlya-sozdaniya-foto/	static_hub	intent_action=sozdanie	intent_action=sozdanie	wordstat_top_queries (1).csv
промты chatgpt мужские фото	18	/promty-dlya-foto-muzhchiny/	programmatic_L1	audience_tag	muzhchina	wordstat_top_queries (1).csv
промт для фото др для мужчины	18	/promty-dlya-foto-muzhchiny/	programmatic_L1	audience_tag	muzhchina	wordstat_top_queries (1).csv
промты gpt обработка фото примеры	18	/promty-dlya-obrabotki-foto/	static_hub	intent_action=obrabotka	intent_action=obrabotka	wordstat_top_queries (1).csv
промт для фото нейросети на документы	18	/foto-na-dokumenty/	programmatic_L1	doc_task_tag	na_dokumenty	wordstat_top_queries (1).csv
где создать промт по фото	18	/promty-dlya-sozdaniya-foto/	static_hub	intent_action=sozdanie	intent_action=sozdanie	wordstat_top_queries (1).csv
нейросеть для изменения фото по промту	18	/promty-dlya-obrabotki-foto/	static_hub	intent_action=obrabotka	intent_action=obrabotka	wordstat_top_queries (1).csv
фотореалистичное фото кошки и человека промт	18	/stil/realistichnoe/s-kotom/	programmatic_L2	style_tag+object_tag	realistichnoe+s_kotom	wordstat_top_queries (1).csv
промт для создания фото мастеру маникюра	18	/promty-dlya-sozdaniya-foto/	static_hub	intent_action=sozdanie	intent_action=sozdanie	wordstat_top_queries (1).csv
промт для ии фото лав ис	18	/stil/love-is/	programmatic_L1	style_tag	love_is	wordstat_top_queries (1).csv
промт для gemini для фото мужчины	18	/promty-dlya-foto-muzhchiny/	programmatic_L1	audience_tag	muzhchina	wordstat_top_queries (1).csv
промт фото девочки 13 лет	18	/promty-dlya-foto-devochki/	programmatic_L1	audience_tag	devochka	wordstat_top_queries (1).csv
промты для фото ии мужские брутальные	18	/promty-dlya-foto-muzhchiny/	programmatic_L1	audience_tag	muzhchina	wordstat_top_queries (1).csv
промты для генерации крутых фото	18	/promty-dlya-sozdaniya-foto/	static_hub	intent_action=sozdanie	intent_action=sozdanie	wordstat_top_queries (1).csv
промт для обработки фото на документы	18	/foto-na-dokumenty/	programmatic_L1	doc_task_tag	na_dokumenty	wordstat_top_queries (1).csv
промты для детских фото мальчиков	17	/promty-dlya-detskih-foto/	programmatic_L1	audience_tag	detskie	wordstat_top_queries (1).csv
лучшие промты для редактирования фото	17	/promty-dlya-obrabotki-foto/	static_hub	intent_action=obrabotka	intent_action=obrabotka	wordstat_top_queries (1).csv
популярные промты для создания фото	17	/promty-dlya-sozdaniya-foto/	static_hub	intent_action=sozdanie	intent_action=sozdanie	wordstat_top_queries (1).csv
промты для генерации фото люди с цветами	17	/s-cvetami/	programmatic_L1	object_tag	s_cvetami	wordstat_top_queries (1).csv
промты снегурочка фото	17	/zimnie/	programmatic_L1	object_tag	zima	wordstat_top_queries (1).csv
как сделать фото в стиле гта промт	17	/stil/gta/	programmatic_L1	style_tag	gta	wordstat_top_queries (1).csv
промт для фото дедушки с внуками	17	/promty-dlya-foto-s-babushkoy/	programmatic_L1	audience_tag	s_babushkoy	wordstat_top_queries (1).csv
промт для gpt мультяшные фото	17	/stil/multyashnoe/	programmatic_L1	style_tag	multyashnoe	wordstat_top_queries (1).csv
промты для генерации фото телеграм	17	/promty-dlya-sozdaniya-foto/	static_hub	intent_action=sozdanie	intent_action=sozdanie	wordstat_top_queries (1).csv
трендовые промты для генерации фото	17	/promty-dlya-sozdaniya-foto/	static_hub	intent_action=sozdanie	intent_action=sozdanie	wordstat_top_queries (1).csv
промт для фото 2 сестер	17	/promty-dlya-foto-s-sestroy/	programmatic_L1	audience_tag	s_sestroy	wordstat_top_queries (1).csv
промт для фото с домашним питомцем	17	/promty-dlya-foto-s-pitomcem/	programmatic_L1	audience_tag	s_pitomcem	wordstat_top_queries (1).csv
промт для обработки старого фото	17	/promty-dlya-restavracii-foto/	static_hub	intent_action=restavratsiya	intent_action=restavratsiya	wordstat_top_queries (1).csv
промт на фото подруг на 8 марта	17	/sobytiya/8-marta/	programmatic_L1	occasion_tag	8_marta	wordstat_top_queries (1).csv
промты для 23 февраля семейная фото	17	/promty-dlya-semejnogo-foto/23-fevralya/	programmatic_L2	audience_tag+occasion_tag	semya+23_fevralya	wordstat_top_queries (1).csv
фото ии с мамой и дочкой промты	17	/promty-dlya-foto-s-mamoy/	programmatic_L1	audience_tag	s_mamoy	wordstat_top_queries (1).csv
промт для нейросети фото полароид	17	/stil/polaroid/	programmatic_L1	style_tag	polaroid	wordstat_top_queries (1).csv
промт фото в стиле сво	17	/v-forme/	programmatic_L1	object_tag	v_forme	wordstat_top_queries (1).csv
промт для фото в форме полиции	17	/v-forme/	programmatic_L1	object_tag	v_forme	wordstat_top_queries (1).csv
смешные промты для обработки фото	17	/promty-dlya-obrabotki-foto/	static_hub	intent_action=obrabotka	intent_action=obrabotka	wordstat_top_queries (1).csv
топ промтов для генерации фото	17	/promty-dlya-sozdaniya-foto/	static_hub	intent_action=sozdanie	intent_action=sozdanie	wordstat_top_queries (1).csv
промт на описание детского фото	17	/promty-dlya-detskih-foto/	programmatic_L1	audience_tag	detskie	wordstat_top_queries (1).csv
промты для красивых фото девушки в ии	17	/promty-dlya-foto-devushki/	programmatic_L1	audience_tag	devushka	wordstat_top_queries (1).csv
промты новогодние советские фото	17	/sobytiya/novyj-god/sovetskoe/	programmatic_L2	occasion_tag+style_tag	novyy_god+sovetskoe	wordstat_top_queries (1).csv
промт для создания фото будущего ребенка	17	/promty-dlya-detskih-foto/	programmatic_L1	audience_tag	detskie	wordstat_top_queries (1).csv
промты для ии фото с короной	17	/s-koronoj/	programmatic_L1	object_tag	s_koronoy	wordstat_top_queries (1).csv
промты для изменения фото gpt	17	/promty-dlya-obrabotki-foto/	static_hub	intent_action=obrabotka	intent_action=obrabotka	wordstat_top_queries (1).csv
промт советское фото нейросеть	16	/stil/sovetskoe/	programmatic_L1	style_tag	sovetskoe	wordstat_top_queries (1).csv
промт для фото в стиле гта са	16	/stil/gta/	programmatic_L1	style_tag	gta	wordstat_top_queries (1).csv
промт на создание фото в стиле масленица	16	/sobytiya/maslenica/	programmatic_L1	occasion_tag	maslenica	wordstat_top_queries (1).csv
промт для фото большой семьи	16	/promty-dlya-semejnogo-foto/	programmatic_L1	audience_tag	semya	wordstat_top_queries (1).csv
промт для создания интерьера по фото	16	/promty-dlya-sozdaniya-foto/	static_hub	intent_action=sozdanie	intent_action=sozdanie	wordstat_top_queries (1).csv
промты для gemini фото для пар	16	/promty-dlya-foto-par/	programmatic_L1	audience_tag	para	wordstat_top_queries (1).csv
шаблоны промтов для обработки фото	16	/promty-dlya-obrabotki-foto/	static_hub	intent_action=obrabotka	intent_action=obrabotka	wordstat_top_queries (1).csv
промт для фото семьи 5 человек	16	/promty-dlya-semejnogo-foto/	programmatic_L1	audience_tag	semya	wordstat_top_queries (1).csv
промт для обработки фото ногтей	16	/promty-dlya-obrabotki-foto/	static_hub	intent_action=obrabotka	intent_action=obrabotka	wordstat_top_queries (1).csv
редактировать фото онлайн с помощью промтов бесплатно	16	/promty-dlya-obrabotki-foto/	static_hub	intent_action=obrabotka	intent_action=obrabotka	wordstat_top_queries (1).csv
промты для фото с участниками сво	16	/v-forme/	programmatic_L1	object_tag	v_forme	wordstat_top_queries (1).csv
промты фото ии военная тематика	16	/v-forme/	programmatic_L1	object_tag	v_forme	wordstat_top_queries (1).csv
примеры промты фото к 14 февраля	16	/sobytiya/14-fevralya/	programmatic_L1	occasion_tag	14_fevralya	wordstat_top_queries (1).csv
промт для фото в зимнем стиле	16	/zimnie/	programmatic_L1	object_tag	zima	wordstat_top_queries (1).csv
промты для фото женщины 55	16	/promty-dlya-foto-devushki/	programmatic_L1	audience_tag	devushka	wordstat_top_queries (1).csv
нейросеть генерирующая фото по промту	16	/promty-dlya-sozdaniya-foto/	static_hub	intent_action=sozdanie	intent_action=sozdanie	wordstat_top_queries (1).csv
промты для женщин ии к фото	15	/promty-dlya-foto-devushki/	programmatic_L1	audience_tag	devushka	wordstat_top_queries (1).csv
промты для парных фото gemini	15	/promty-dlya-foto-par/	programmatic_L1	audience_tag	para	wordstat_top_queries (1).csv
промты для создания картин из фото	15	/promty-dlya-sozdaniya-foto/	static_hub	intent_action=sozdanie	intent_action=sozdanie	wordstat_top_queries (1).csv
крутые промты для редактирования фото	15	/promty-dlya-obrabotki-foto/	static_hub	intent_action=obrabotka	intent_action=obrabotka	wordstat_top_queries (1).csv
промт для объединения детских фото	15	/promty-dlya-detskih-foto/	programmatic_L1	audience_tag	detskie	wordstat_top_queries (1).csv
промт для создания новогодних фото	15	/sobytiya/novyj-god/	programmatic_L1	occasion_tag	novyy_god	wordstat_top_queries (1).csv
промт для chatgpt для фото мужчины	15	/promty-dlya-foto-muzhchiny/	programmatic_L1	audience_tag	muzhchina	wordstat_top_queries (1).csv
промт для фото на паспорт рф	15	/foto-na-pasport/	programmatic_L1	doc_task_tag	na_pasport	wordstat_top_queries (1).csv
промт для создания фото с кошкой	15	/s-kotom/	programmatic_L1	object_tag	s_kotom	wordstat_top_queries (1).csv
промт для обработки фото собаки	15	/promty-dlya-obrabotki-foto/	static_hub	intent_action=obrabotka	intent_action=obrabotka	wordstat_top_queries (1).csv
промт для фото нейросети свадьба	15	/sobytiya/svadba/	programmatic_L1	occasion_tag	svadba	wordstat_top_queries (1).csv
промт для фото нейросети с котом	15	/s-kotom/	programmatic_L1	object_tag	s_kotom	wordstat_top_queries (1).csv
промты для генерации классных фото	15	/promty-dlya-sozdaniya-foto/	static_hub	intent_action=sozdanie	intent_action=sozdanie	wordstat_top_queries (1).csv
промты для фото мужчины шаблоны	15	/promty-dlya-foto-muzhchiny/	programmatic_L1	audience_tag	muzhchina	wordstat_top_queries (1).csv
готовый промт для генерации фото день рождения	15	/sobytiya/den-rozhdeniya/	programmatic_L1	occasion_tag	den_rozhdeniya	wordstat_top_queries (1).csv
промт для создания фото лав ис	14	/stil/love-is/	programmatic_L1	style_tag	love_is	wordstat_top_queries (1).csv
промт для фото с роналду	14	/so-znamenitostyu/	programmatic_L1	object_tag	so_znamenitostyu	wordstat_top_queries (1).csv
готовые промты для обработки фото в chatgpt	14	/promty-dlya-obrabotki-foto/	static_hub	intent_action=obrabotka	intent_action=obrabotka	wordstat_top_queries (1).csv
ии фото со своим питомцем промт	14	/promty-dlya-foto-s-pitomcem/	programmatic_L1	audience_tag	s_pitomcem	wordstat_top_queries (1).csv
бесплатно без регистрации сделать промт по фото	14	/promty-dlya-sozdaniya-foto/	static_hub	intent_action=sozdanie	intent_action=sozdanie	wordstat_top_queries (1).csv
фото в стиле новогодней открытки промт	14	/sobytiya/novyj-god/otkrytka/	programmatic_L2	occasion_tag+style_tag	novyy_god+otkrytka	wordstat_top_queries (1).csv
промт для фото мамы и младенца	14	/promty-dlya-foto-s-mamoy/	programmatic_L1	audience_tag	s_mamoy	wordstat_top_queries (1).csv
смешные промты для фото мужчины	14	/promty-dlya-foto-muzhchiny/	programmatic_L1	audience_tag	muzhchina	wordstat_top_queries (1).csv
промт для фото беременной девушки	14	/promty-dlya-foto-devushki/	programmatic_L1	audience_tag	devushka	wordstat_top_queries (1).csv
промт на фото фотосессии мужчин	14	/promty-dlya-foto-muzhchiny/	programmatic_L1	audience_tag	muzhchina	wordstat_top_queries (1).csv
промт для фото на мальдивах	14	/na-more/	programmatic_L1	object_tag	na_more	wordstat_top_queries (1).csv
промт для создания фото в ии примеры	14	/promty-dlya-sozdaniya-foto/	static_hub	intent_action=sozdanie	intent_action=sozdanie	wordstat_top_queries (1).csv
промт для создания семейного фото ии	14	/promty-dlya-semejnogo-foto/	programmatic_L1	audience_tag	semya	wordstat_top_queries (1).csv
промт для создания фото на день влюбленных	14	/promty-dlya-foto-vlyublennykh/14-fevralya/	programmatic_L2	audience_tag+occasion_tag	vlyublennykh+14_fevralya	wordstat_top_queries (1).csv
сделать промт из фото бесплатно онлайн	14	/promty-dlya-sozdaniya-foto/	static_hub	intent_action=sozdanie	intent_action=sozdanie	wordstat_top_queries (1).csv
супер промт восстановление старого фото 2026	14	/promty-dlya-restavracii-foto/	static_hub	intent_action=restavratsiya	intent_action=restavratsiya	wordstat_top_queries (1).csv
промт для улучшения фото в ии	14	/promty-dlya-uluchsheniya-foto/	static_hub	intent_action=uluchshenie	intent_action=uluchshenie	wordstat_top_queries (1).csv
как писать промты для создания фото	14	/promty-dlya-sozdaniya-foto/	static_hub	intent_action=sozdanie	intent_action=sozdanie	wordstat_top_queries (1).csv
промт для фото на паспорт мужчине	14	/promty-dlya-foto-muzhchiny/foto-na-pasport/	programmatic_L2	audience_tag+doc_task_tag	muzhchina+na_pasport	wordstat_top_queries (1).csv
промт для портретного фото девушки	14	/promty-dlya-foto-devushki/portret/	programmatic_L2	audience_tag+style_tag	devushka+portret	wordstat_top_queries (1).csv
промты для фото ребенок 6 месяцев	14	/promty-dlya-detskih-foto/	programmatic_L1	audience_tag	detskie	wordstat_top_queries (1).csv
как сделать промт для нейросети по фото	14	/promty-dlya-sozdaniya-foto/	static_hub	intent_action=sozdanie	intent_action=sozdanie	wordstat_top_queries (1).csv
промты для фото 23 февраля моряки	14	/sobytiya/23-fevralya/	programmatic_L1	occasion_tag	23_fevralya	wordstat_top_queries (1).csv
промт новогоднее фото ссср	14	/sobytiya/novyj-god/sovetskoe/	programmatic_L2	occasion_tag+style_tag	novyy_god+sovetskoe	wordstat_top_queries (1).csv
промт для улучшения фото портрета	14	/stil/portret/	programmatic_L1	style_tag	portret	wordstat_top_queries (1).csv
промты для мужских фото в чате gpt	14	/promty-dlya-foto-muzhchiny/	programmatic_L1	audience_tag	muzhchina	wordstat_top_queries (1).csv
промт для ии коллаж из трех фото	14	/stil/kollazh/	programmatic_L1	style_tag	kollazh	wordstat_top_queries (1).csv
промт для семейного фото боком	14	/promty-dlya-semejnogo-foto/v-profil/	programmatic_L2	audience_tag+object_tag	semya+v_profil	wordstat_top_queries (1).csv
как писать промты для нейросети генерации фото	13	/promty-dlya-sozdaniya-foto/	static_hub	intent_action=sozdanie	intent_action=sozdanie	wordstat_top_queries (1).csv
промт для фотосессии нейросети фото поколений	13	/promty-dlya-foto-pokoleniy/	programmatic_L1	audience_tag	pokoleniy	wordstat_top_queries (1).csv
промт чтобы объединить семью на одном фото	13	/promty-dlya-semejnogo-foto/	programmatic_L1	audience_tag	semya	wordstat_top_queries (1).csv
промт для свадебного фото пары	13	/sobytiya/svadba/	programmatic_L1	occasion_tag	svadba	wordstat_top_queries (1).csv
готовый промт для фото к 8 марта	13	/sobytiya/8-marta/	programmatic_L1	occasion_tag	8_marta	wordstat_top_queries (1).csv
промт для обработки фото интерьера	13	/promty-dlya-obrabotki-foto/	static_hub	intent_action=obrabotka	intent_action=obrabotka	wordstat_top_queries (1).csv
промты для фото chatgpt фотосессия	13	/promty-dlya-fotosessii/	static_hub	intent_action=fotosessiya	intent_action=fotosessiya	wordstat_top_queries (1).csv
промт для семейного фото в студии	13	/promty-dlya-semejnogo-foto/studiynoe/	programmatic_L2	audience_tag+style_tag	semya+studiynoe	wordstat_top_queries (1).csv
промт для фото нейросети для резюме	13	/foto-na-rezume/	programmatic_L1	doc_task_tag	na_rezume	wordstat_top_queries (1).csv
промт для красивого фото на аватарку	13	/foto-na-avatarku/	programmatic_L1	doc_task_tag	na_avatarku	wordstat_top_queries (1).csv
промты фото с погибшим на сво	13	/v-forme/	programmatic_L1	object_tag	v_forme	wordstat_top_queries (1).csv
промты для парных фото нано банана	13	/promty-dlya-foto-par/	programmatic_L1	audience_tag	para	wordstat_top_queries (1).csv
создать изображение по промту и фото	13	/promty-dlya-sozdaniya-foto/	static_hub	intent_action=sozdanie	intent_action=sozdanie	wordstat_top_queries (1).csv
промты для фото с примерами пар	13	/promty-dlya-foto-par/	programmatic_L1	audience_tag	para	wordstat_top_queries (1).csv
промты для ии фото авто	13	/s-mashinoy/	programmatic_L1	object_tag	s_mashinoy	wordstat_top_queries (1).csv
промт для фото в профиль 3 человек	13	/v-profil/	programmatic_L1	object_tag	v_profil	wordstat_top_queries (1).csv
промт студийное фото питомца	13	/promty-dlya-foto-s-pitomcem/studiynoe/	programmatic_L2	audience_tag+style_tag	s_pitomcem+studiynoe	wordstat_top_queries (1).csv
как обработать фото по промту	13	/promty-dlya-obrabotki-foto/	static_hub	intent_action=obrabotka	intent_action=obrabotka	wordstat_top_queries (1).csv
промт для ии фото вдвоем	13	/promty-dlya-foto-par/	programmatic_L1	audience_tag	para	wordstat_top_queries (1).csv
промты для gemini семейные фото	13	/promty-dlya-semejnogo-foto/	programmatic_L1	audience_tag	semya	wordstat_top_queries (1).csv
идеальный промт для генерации фото примеры	13	/promty-dlya-sozdaniya-foto/	static_hub	intent_action=sozdanie	intent_action=sozdanie	wordstat_top_queries (1).csv
промт для создания вязаных фото	13	/promty-dlya-sozdaniya-foto/	static_hub	intent_action=sozdanie	intent_action=sozdanie	wordstat_top_queries (1).csv
промт для нано банана семейное фото	13	/promty-dlya-semejnogo-foto/	programmatic_L1	audience_tag	semya	wordstat_top_queries (1).csv
промт для генерации фото в купальнике	13	/promty-dlya-sozdaniya-foto/	static_hub	intent_action=sozdanie	intent_action=sozdanie	wordstat_top_queries (1).csv
промт на мужское фото на горнолыжном курорте	13	/promty-dlya-foto-muzhchiny/zimnie/	programmatic_L2	audience_tag+object_tag	muzhchina+zima	wordstat_top_queries (1).csv
ai промт генератор из фото	13	/promty-dlya-sozdaniya-foto/	static_hub	intent_action=sozdanie	intent_action=sozdanie	wordstat_top_queries (1).csv
промт для фото в стиле аватар	13	/foto-na-avatarku/	programmatic_L1	doc_task_tag	na_avatarku	wordstat_top_queries (1).csv
промты для генерации фото подростка	13	/promty-dlya-foto-podrostka/	programmatic_L1	audience_tag	podrostok	wordstat_top_queries (1).csv
промт для фото нейросети для девушки короткие	13	/promty-dlya-foto-devushki/	programmatic_L1	audience_tag	devushka	wordstat_top_queries (1).csv
промт для генерации фото полароид	12	/stil/polaroid/	programmatic_L1	style_tag	polaroid	wordstat_top_queries (1).csv
семейное фото голова на голове промт	12	/promty-dlya-semejnogo-foto/	programmatic_L1	audience_tag	semya	wordstat_top_queries (1).csv
создать новогоднее фото промт	12	/sobytiya/novyj-god/	programmatic_L1	occasion_tag	novyy_god	wordstat_top_queries (1).csv
промт для фото в стиле поколение	12	/promty-dlya-foto-pokoleniy/	programmatic_L1	audience_tag	pokoleniy	wordstat_top_queries (1).csv
промт для создания фото врача	12	/promty-dlya-sozdaniya-foto/	static_hub	intent_action=sozdanie	intent_action=sozdanie	wordstat_top_queries (1).csv
промт для нано банано фото с парнем	12	/promty-dlya-foto-s-parnem/	programmatic_L1	audience_tag	s_parnem	wordstat_top_queries (1).csv
промт на фото с знаменитостью полароида	12	/stil/polaroid/so-znamenitostyu/	programmatic_L2	style_tag+object_tag	polaroid+so_znamenitostyu	wordstat_top_queries (1).csv
промт для создания фото бесплатно текст	12	/promty-dlya-sozdaniya-foto/	static_hub	intent_action=sozdanie	intent_action=sozdanie	wordstat_top_queries (1).csv
