query	volume	landing_url	page_type	matched_dimensions	matched_values	source_file
промт для фото папа и сын	94	/promty-dlya-foto-s-papoy/	programmatic_L1	audience_tag	s_papoy	wordstat_top_queries (1).csv
промты для нейросети для обработки фото мужские	94	/promty-dlya-foto-muzhchiny/	programmatic_L1	audience_tag	muzhchina	wordstat_top_queries (1).csv
промт для ии фото с подругой	94	/promty-dlya-foto-s-podrugoy/	programmatic_L1	audience_tag	s_podrugoy	wordstat_top_queries (1).csv
промт для создания фото с ребенком	93	/promty-dlya-detskih-foto/	programmatic_L1	audience_tag	detskie	wordstat_top_queries (1).csv
промт заменить лица на фото	92	/promty-dlya-zameny-lica/	static_hub	intent_action=zamena_lica	intent_action=zamena_lica	wordstat_top_queries (1).csv
промт для фото лов из	92	/stil/love-is/	programmatic_L1	style_tag	love_is	wordstat_top_queries (1).csv
промт для фото с букетом цветов	92	/s-cvetami/	programmatic_L1	object_tag	s_cvetami	wordstat_top_queries (1).csv
промт черно белое фото с ребенком	92	/promty-dlya-detskih-foto/cherno-beloe/	programmatic_L2	audience_tag+style_tag	detskie+cherno_beloe	wordstat_top_queries (1).csv
промты для фото девушки портрет	92	/promty-dlya-foto-devushki/portret/	programmatic_L2	audience_tag+style_tag	devushka+portret	wordstat_top_queries (1).csv
описание промт на фото девушки	92	/promty-dlya-foto-devushki/	programmatic_L1	audience_tag	devushka	wordstat_top_queries (1).csv
черно белое фото нейросеть промт	92	/stil/cherno-beloe/	programmatic_L1	style_tag	cherno_beloe	wordstat_top_queries (1).csv
промт для создания фото семьи	91	/promty-dlya-semejnogo-foto/	programmatic_L1	audience_tag	semya	wordstat_top_queries (1).csv
промт для цветокоррекции фото	90	/promty-dlya-obrabotki-foto/	static_hub	intent_action=obrabotka	intent_action=obrabotka	wordstat_top_queries (1).csv
промт студийное фото мужчина	90	/promty-dlya-foto-muzhchiny/studiynoe/	programmatic_L2	audience_tag+style_tag	muzhchina+studiynoe	wordstat_top_queries (1).csv
промт для фото мужчины в военной форме	90	/promty-dlya-foto-muzhchiny/v-forme/	programmatic_L2	audience_tag+object_tag	muzhchina+v_forme	wordstat_top_queries (1).csv
промт для генерации текста по фото	90	/promty-dlya-sozdaniya-foto/	static_hub	intent_action=sozdanie	intent_action=sozdanie	wordstat_top_queries (1).csv
промты для ии фото с военным	89	/v-forme/	programmatic_L1	object_tag	v_forme	wordstat_top_queries (1).csv
промты для фото ии на масленицу	89	/sobytiya/maslenica/	programmatic_L1	occasion_tag	maslenica	wordstat_top_queries (1).csv
промт чтобы сделать фото на паспорт	89	/foto-na-pasport/	programmatic_L1	doc_task_tag	na_pasport	wordstat_top_queries (1).csv
точный и негативный промты для создания фото	88	/promty-dlya-sozdaniya-foto/	static_hub	intent_action=sozdanie	intent_action=sozdanie	wordstat_top_queries (1).csv
промт для фото ребенка на масленицу	88	/promty-dlya-detskih-foto/maslenica/	programmatic_L2	audience_tag+occasion_tag	detskie+maslenica	wordstat_top_queries (1).csv
промт для фильтра фото	88	/promty-dlya-obrabotki-foto/	static_hub	intent_action=obrabotka	intent_action=obrabotka	wordstat_top_queries (1).csv
промт для фото 90х	88	/stil/retro/	programmatic_L1	style_tag	retro	wordstat_top_queries (1).csv
промт для генерации фото на день рождения	87	/sobytiya/den-rozhdeniya/	programmatic_L1	occasion_tag	den_rozhdeniya	wordstat_top_queries (1).csv
промты для улучшения фото gpt	87	/promty-dlya-uluchsheniya-foto/	static_hub	intent_action=uluchshenie	intent_action=uluchshenie	wordstat_top_queries (1).csv
промт для фото 23 февраля военный	87	/sobytiya/23-fevralya/v-forme/	programmatic_L2	occasion_tag+object_tag	23_fevralya+v_forme	wordstat_top_queries (1).csv
промт на коллаж из фото	87	/stil/kollazh/	programmatic_L1	style_tag	kollazh	wordstat_top_queries (1).csv
промт чтобы добавить человека на фото	86	/promty-dlya-zameny-lica/	static_hub	intent_action=zamena_lica	intent_action=zamena_lica	wordstat_top_queries (1).csv
промты для создания картинок по фото	85	/promty-dlya-sozdaniya-foto/	static_hub	intent_action=sozdanie	intent_action=sozdanie	wordstat_top_queries (1).csv
промт для фото в стиле ссср	85	/stil/sovetskoe/	programmatic_L1	style_tag	sovetskoe	wordstat_top_queries (1).csv
промт для фото день защитника отечества	84	/sobytiya/23-fevralya/	programmatic_L1	occasion_tag	23_fevralya	wordstat_top_queries (1).csv
промт для создания фото с помощью ии	84	/promty-dlya-sozdaniya-foto/	static_hub	intent_action=sozdanie	intent_action=sozdanie	wordstat_top_queries (1).csv
промт для фото со знаменитостью полароид	84	/stil/polaroid/so-znamenitostyu/	programmatic_L2	style_tag+object_tag	polaroid+so_znamenitostyu	wordstat_top_queries (1).csv
промт для генерации фото на 23 февраля	83	/sobytiya/23-fevralya/	programmatic_L1	occasion_tag	23_fevralya	wordstat_top_queries (1).csv
промты для обработки фото gemini	83	/promty-dlya-obrabotki-foto/	static_hub	intent_action=obrabotka	intent_action=obrabotka	wordstat_top_queries (1).csv
промт для фото семьи на черном фоне	81	/promty-dlya-semejnogo-foto/	programmatic_L1	audience_tag	semya	wordstat_top_queries (1).csv
промт для красивой обработки фото	81	/promty-dlya-obrabotki-foto/	static_hub	intent_action=obrabotka	intent_action=obrabotka	wordstat_top_queries (1).csv
промты для нейросети для обработки фото женские	80	/promty-dlya-foto-devushki/	programmatic_L1	audience_tag	devushka	wordstat_top_queries (1).csv
промт для создания фото со знаменитостью	80	/so-znamenitostyu/	programmatic_L1	object_tag	so_znamenitostyu	wordstat_top_queries (1).csv
ии промт фото с папой	80	/promty-dlya-foto-s-papoy/	programmatic_L1	audience_tag	s_papoy	wordstat_top_queries (1).csv
промт для ии фото в зеркале	80	/v-zerkale/	programmatic_L1	object_tag	v_zerkale	wordstat_top_queries (1).csv
промт для создания фото через ии	79	/promty-dlya-sozdaniya-foto/	static_hub	intent_action=sozdanie	intent_action=sozdanie	wordstat_top_queries (1).csv
промт для фото влюбленной пары	79	/promty-dlya-foto-vlyublennykh/	programmatic_L1	audience_tag	vlyublennykh	wordstat_top_queries (1).csv
промт для генерации фото love is	79	/stil/love-is/	programmatic_L1	style_tag	love_is	wordstat_top_queries (1).csv
промты для нейросети для обработки фото пары	79	/promty-dlya-obrabotki-foto/	static_hub	intent_action=obrabotka	intent_action=obrabotka	wordstat_top_queries (1).csv
промт для нейросети для улучшения фото	79	/promty-dlya-uluchsheniya-foto/	static_hub	intent_action=uluchshenie	intent_action=uluchshenie	wordstat_top_queries (1).csv
промт для создания фото на масленицу	78	/sobytiya/maslenica/	programmatic_L1	occasion_tag	maslenica	wordstat_top_queries (1).csv
промты для создания фото чат гпт	78	/promty-dlya-sozdaniya-foto/	static_hub	intent_action=sozdanie	intent_action=sozdanie	wordstat_top_queries (1).csv
промт фото в снегу	78	/zimnie/	programmatic_L1	object_tag	zima	wordstat_top_queries (1).csv
подробный промт для генерации фото в нейросети	78	/promty-dlya-sozdaniya-foto/	static_hub	intent_action=sozdanie	intent_action=sozdanie	wordstat_top_queries (1).csv
промт для нейросети фото на паспорт	77	/foto-na-pasport/	programmatic_L1	doc_task_tag	na_pasport	wordstat_top_queries (1).csv
промты для создания фото товаров	77	/promty-dlya-sozdaniya-foto/	static_hub	intent_action=sozdanie	intent_action=sozdanie	wordstat_top_queries (1).csv
промт чб фото для ии	76	/stil/cherno-beloe/	programmatic_L1	style_tag	cherno_beloe	wordstat_top_queries (1).csv
ии редактор фото по промту	76	/promty-dlya-obrabotki-foto/	static_hub	intent_action=obrabotka	intent_action=obrabotka	wordstat_top_queries (1).csv
промт для соединения двух фото	75	/promty-dlya-kollazha/	static_hub	intent_action=kollazh	intent_action=kollazh	wordstat_top_queries (1).csv
промт для свадебного фото ии	75	/sobytiya/svadba/	programmatic_L1	occasion_tag	svadba	wordstat_top_queries (1).csv
промт для делового фото женщины	75	/promty-dlya-foto-devushki/delovoe/	programmatic_L2	audience_tag+style_tag	devushka+delovoe	wordstat_top_queries (1).csv
промты для фото девушки зимние	75	/promty-dlya-foto-devushki/zimnie/	programmatic_L2	audience_tag+object_tag	devushka+zima	wordstat_top_queries (1).csv
промты для фото gemini женские	75	/promty-dlya-foto-devushki/	programmatic_L1	audience_tag	devushka	wordstat_top_queries (1).csv
промт для переделки фото	75	/promty-dlya-obrabotki-foto/	static_hub	intent_action=obrabotka	intent_action=obrabotka	wordstat_top_queries (1).csv
промт семейное фото поколений	74	/promty-dlya-semejnogo-foto/	programmatic_L1	audience_tag	semya	wordstat_top_queries (1).csv
промт для ии фото с мужем	74	/promty-dlya-foto-s-muzhem/	programmatic_L1	audience_tag	s_muzhem	wordstat_top_queries (1).csv
промт для фото нейросети семья	74	/promty-dlya-semejnogo-foto/	programmatic_L1	audience_tag	semya	wordstat_top_queries (1).csv
промт для весеннего фото для ии	73	/vesennie/	programmatic_L1	object_tag	vesna	wordstat_top_queries (1).csv
промт для генерации фото с машиной	73	/s-mashinoy/	programmatic_L1	object_tag	s_mashinoy	wordstat_top_queries (1).csv
промт для создания фото с парнем	72	/promty-dlya-foto-s-parnem/	programmatic_L1	audience_tag	s_parnem	wordstat_top_queries (1).csv
промт для объединения двух фото в одно	72	/promty-dlya-kollazha/	static_hub	intent_action=kollazh	intent_action=kollazh	wordstat_top_queries (1).csv
промты для генерации фото портрет	72	/stil/portret/	programmatic_L1	style_tag	portret	wordstat_top_queries (1).csv
промт для обработки фото автомобиля	72	/s-mashinoy/	programmatic_L1	object_tag	s_mashinoy	wordstat_top_queries (1).csv
промты для генерации мужских фото	71	/promty-dlya-foto-muzhchiny/	programmatic_L1	audience_tag	muzhchina	wordstat_top_queries (1).csv
промт для создания аватарки по фото	71	/foto-na-avatarku/	programmatic_L1	doc_task_tag	na_avatarku	wordstat_top_queries (1).csv
промт для фото в стиле советской открытки	71	/stil/otkrytka/	programmatic_L1	style_tag	otkrytka	wordstat_top_queries (1).csv
промт для нейросети фото поколений	71	/promty-dlya-foto-pokoleniy/	programmatic_L1	audience_tag	pokoleniy	wordstat_top_queries (1).csv
промт для фото в стиле 90х	70	/stil/retro/	programmatic_L1	style_tag	retro	wordstat_top_queries (1).csv
фото мамы и взрослой дочери промт	69	/promty-dlya-foto-s-mamoy/	programmatic_L1	audience_tag	s_mamoy	wordstat_top_queries (1).csv
крутые промты для обработки фото	69	/promty-dlya-obrabotki-foto/	static_hub	intent_action=obrabotka	intent_action=obrabotka	wordstat_top_queries (1).csv
промт для создания фото на документы	68	/foto-na-dokumenty/	programmatic_L1	doc_task_tag	na_dokumenty	wordstat_top_queries (1).csv
нано банана промт фото девушки	68	/promty-dlya-foto-devushki/	programmatic_L1	audience_tag	devushka	wordstat_top_queries (1).csv
промт для создания шаржа по фото	68	/promty-dlya-sozdaniya-foto/	static_hub	intent_action=sozdanie	intent_action=sozdanie	wordstat_top_queries (1).csv
промт для фото влюбленный взгляд	68	/promty-dlya-foto-vlyublennykh/	programmatic_L1	audience_tag	vlyublennykh	wordstat_top_queries (1).csv
промты для фото в нейросети ребенка	67	/promty-dlya-detskih-foto/	programmatic_L1	audience_tag	detskie	wordstat_top_queries (1).csv
промты для редактирования фото девушки	67	/promty-dlya-foto-devushki/	programmatic_L1	audience_tag	devushka	wordstat_top_queries (1).csv
подробный промт для обработки фото	67	/promty-dlya-obrabotki-foto/	static_hub	intent_action=obrabotka	intent_action=obrabotka	wordstat_top_queries (1).csv
готовые промты для фото женщин	67	/promty-dlya-foto-devushki/	programmatic_L1	audience_tag	devushka	wordstat_top_queries (1).csv
промт для фото на загранпаспорт	67	/foto-na-zagranpasport/	programmatic_L1	doc_task_tag	na_zagranpasport	wordstat_top_queries (1).csv
промт фото банан нано женщины	66	/promty-dlya-foto-devushki/	programmatic_L1	audience_tag	devushka	wordstat_top_queries (1).csv
промт для генерации семейного фото	66	/promty-dlya-semejnogo-foto/	programmatic_L1	audience_tag	semya	wordstat_top_queries (1).csv
промт для фото бабушки с внуками	66	/promty-dlya-foto-s-babushkoy/	programmatic_L1	audience_tag	s_babushkoy	wordstat_top_queries (1).csv
промт для фото папа и дочь	66	/promty-dlya-foto-s-papoy/	programmatic_L1	audience_tag	s_papoy	wordstat_top_queries (1).csv
промты для реалистичных фото мужчин	66	/promty-dlya-foto-muzhchiny/realistichnoe/	programmatic_L2	audience_tag+style_tag	muzhchina+realistichnoe	wordstat_top_queries (1).csv
промт для ии фото с питомцем	66	/promty-dlya-foto-s-pitomcem/	programmatic_L1	audience_tag	s_pitomcem	wordstat_top_queries (1).csv
промт для обработки фото детей	65	/promty-dlya-obrabotki-foto/	static_hub	intent_action=obrabotka	intent_action=obrabotka	wordstat_top_queries (1).csv
нано банана сделать фото промт	65	/promty-dlya-sozdaniya-foto/	static_hub	intent_action=sozdanie	intent_action=sozdanie	wordstat_top_queries (1).csv
промт для обработки фото лица	65	/promty-dlya-obrabotki-foto/	static_hub	intent_action=obrabotka	intent_action=obrabotka	wordstat_top_queries (1).csv
промт для фото в стиле гта 5	64	/stil/gta/	programmatic_L1	style_tag	gta	wordstat_top_queries (1).csv
промт для создания портретного фото	64	/stil/portret/	programmatic_L1	style_tag	portret	wordstat_top_queries (1).csv
промт фото с актером	64	/so-znamenitostyu/	programmatic_L1	object_tag	so_znamenitostyu	wordstat_top_queries (1).csv
промт для фото в стиле лав ис	64	/stil/love-is/	programmatic_L1	style_tag	love_is	wordstat_top_queries (1).csv
промт для фото бабушки и дедушки	64	/promty-dlya-foto-s-babushkoy/	programmatic_L1	audience_tag	s_babushkoy	wordstat_top_queries (1).csv
промт для фото вдвоем	64	/promty-dlya-foto-par/	programmatic_L1	audience_tag	para	wordstat_top_queries (1).csv
промт для ии фото с дочкой	64	/promty-dlya-foto-s-dochkoy/	programmatic_L1	audience_tag	s_dochkoy	wordstat_top_queries (1).csv
промт для ии деловое фото	64	/stil/delovoe/	programmatic_L1	style_tag	delovoe	wordstat_top_queries (1).csv
промт на фото с чебурашкой	63	/so-znamenitostyu/	programmatic_L1	object_tag	so_znamenitostyu	wordstat_top_queries (1).csv
промт на русском для фото девушке	63	/promty-dlya-foto-devushki/	programmatic_L1	audience_tag	devushka	wordstat_top_queries (1).csv
промт для фото с эпштейном	63	/so-znamenitostyu/	programmatic_L1	object_tag	so_znamenitostyu	wordstat_top_queries (1).csv
промт для генерации фото на паспорт	62	/foto-na-pasport/	programmatic_L1	doc_task_tag	na_pasport	wordstat_top_queries (1).csv
промт для создания фото с мамой	62	/promty-dlya-foto-s-mamoy/	programmatic_L1	audience_tag	s_mamoy	wordstat_top_queries (1).csv
промт для студийного фото девушки	62	/promty-dlya-foto-devushki/studiynoe/	programmatic_L2	audience_tag+style_tag	devushka+studiynoe	wordstat_top_queries (1).csv
промт для фото на день рождения мужчине	62	/promty-dlya-foto-muzhchiny/den-rozhdeniya/	programmatic_L2	audience_tag+occasion_tag	muzhchina+den_rozhdeniya	wordstat_top_queries (1).csv
промт для создания совместного фото	62	/promty-dlya-foto-par/	programmatic_L1	audience_tag	para	wordstat_top_queries (1).csv
промт для создания фото куклы	62	/promty-dlya-sozdaniya-foto/	static_hub	intent_action=sozdanie	intent_action=sozdanie	wordstat_top_queries (1).csv
промт для фото лица семьи	61	/promty-dlya-semejnogo-foto/	programmatic_L1	audience_tag	semya	wordstat_top_queries (1).csv
промт для улучшения качества фото gemini	61	/promty-dlya-uluchsheniya-foto/	static_hub	intent_action=uluchshenie	intent_action=uluchshenie	wordstat_top_queries (1).csv
промт для фото в зеркале с парнем	61	/promty-dlya-foto-s-parnem/v-zerkale/	programmatic_L2	audience_tag+object_tag	s_parnem+v_zerkale	wordstat_top_queries (1).csv
фото ии папа сын промт	61	/promty-dlya-foto-s-papoy/	programmatic_L1	audience_tag	s_papoy	wordstat_top_queries (1).csv
промт для ии фото в профиль	60	/v-profil/	programmatic_L1	object_tag	v_profil	wordstat_top_queries (1).csv
промт для создания фото для резюме	60	/foto-na-rezume/	programmatic_L1	doc_task_tag	na_rezume	wordstat_top_queries (1).csv
промты для нейросети старых фото	60	/promty-dlya-restavracii-foto/	static_hub	intent_action=restavratsiya	intent_action=restavratsiya	wordstat_top_queries (1).csv
промт фото девушки в нижнем белье	59	/promty-dlya-foto-devushki/	programmatic_L1	audience_tag	devushka	wordstat_top_queries (1).csv
промты для стилизации фото	59	/promty-dlya-obrabotki-foto/	static_hub	intent_action=obrabotka	intent_action=obrabotka	wordstat_top_queries (1).csv
промт для фото за рулем	59	/s-mashinoy/	programmatic_L1	object_tag	s_mashinoy	wordstat_top_queries (1).csv
промт для обработки фото наращивания ресниц	59	/promty-dlya-obrabotki-foto/	static_hub	intent_action=obrabotka	intent_action=obrabotka	wordstat_top_queries (1).csv
промт для ии фото с собакой	59	/s-sobakoj/	programmatic_L1	object_tag	s_sobakoy	wordstat_top_queries (1).csv
промт для фото с кумиром	58	/so-znamenitostyu/	programmatic_L1	object_tag	so_znamenitostyu	wordstat_top_queries (1).csv
промт для нейросети для улучшения качества фото	58	/promty-dlya-uluchsheniya-foto/	static_hub	intent_action=uluchshenie	intent_action=uluchshenie	wordstat_top_queries (1).csv
промт для красивого фото мужчины	58	/promty-dlya-foto-muzhchiny/	programmatic_L1	audience_tag	muzhchina	wordstat_top_queries (1).csv
готовый промт для улучшения фото	58	/promty-dlya-uluchsheniya-foto/	static_hub	intent_action=uluchshenie	intent_action=uluchshenie	wordstat_top_queries (1).csv
промт для фото в кокошнике	58	/s-kotom/	programmatic_L1	object_tag	s_kotom	wordstat_top_queries (1).csv
сделать промт по фото онлайн	58	/promty-dlya-sozdaniya-foto/	static_hub	intent_action=sozdanie	intent_action=sozdanie	wordstat_top_queries (1).csv
промт для чат gpt для улучшения фото	57	/promty-dlya-uluchsheniya-foto/	static_hub	intent_action=uluchshenie	intent_action=uluchshenie	wordstat_top_queries (1).csv
промт для фото нейросети масленица	57	/sobytiya/maslenica/	programmatic_L1	occasion_tag	maslenica	wordstat_top_queries (1).csv
промты для gemini фото мужские	57	/promty-dlya-foto-muzhchiny/	programmatic_L1	audience_tag	muzhchina	wordstat_top_queries (1).csv
бот для создания промта по фото	56	/promty-dlya-sozdaniya-foto/	static_hub	intent_action=sozdanie	intent_action=sozdanie	wordstat_top_queries (1).csv
промты на фото младенца	56	/promty-dlya-foto-malysha/	programmatic_L1	audience_tag	malysh	wordstat_top_queries (1).csv
промты для фото мужчины с машиной	56	/promty-dlya-foto-muzhchiny/s-mashinoy/	programmatic_L2	audience_tag+object_tag	muzhchina+s_mashinoy	wordstat_top_queries (1).csv
готовый промт для семейного фото	56	/promty-dlya-semejnogo-foto/	programmatic_L1	audience_tag	semya	wordstat_top_queries (1).csv
промт для создания мужского фото	55	/promty-dlya-foto-muzhchiny/	programmatic_L1	audience_tag	muzhchina	wordstat_top_queries (1).csv
промт для мужского фото gpt	55	/promty-dlya-foto-muzhchiny/	programmatic_L1	audience_tag	muzhchina	wordstat_top_queries (1).csv
промт для черно белого семейного фото	55	/promty-dlya-semejnogo-foto/cherno-beloe/	programmatic_L2	audience_tag+style_tag	semya+cherno_beloe	wordstat_top_queries (1).csv
промт фото новый год	55	/sobytiya/novyj-god/	programmatic_L1	occasion_tag	novyy_god	wordstat_top_queries (1).csv
промт фото на 30 лет	55	/sobytiya/den-rozhdeniya/	programmatic_L1	occasion_tag	den_rozhdeniya	wordstat_top_queries (1).csv
подробный промт для генерации изображения по фото	55	/promty-dlya-sozdaniya-foto/	static_hub	intent_action=sozdanie	intent_action=sozdanie	wordstat_top_queries (1).csv
промты для создания крутых фото	55	/promty-dlya-sozdaniya-foto/	static_hub	intent_action=sozdanie	intent_action=sozdanie	wordstat_top_queries (1).csv
промты для фото девушки в студии	55	/promty-dlya-foto-devushki/studiynoe/	programmatic_L2	audience_tag+style_tag	devushka+studiynoe	wordstat_top_queries (1).csv
промт для фото в стиле 14 февраля	54	/sobytiya/14-fevralya/	programmatic_L1	occasion_tag	14_fevralya	wordstat_top_queries (1).csv
промт для фото с братом	54	/promty-dlya-foto-s-bratom/	programmatic_L1	audience_tag	s_bratom	wordstat_top_queries (1).csv
крутой промт для фото мужчины	54	/promty-dlya-foto-muzhchiny/	programmatic_L1	audience_tag	muzhchina	wordstat_top_queries (1).csv
промты для создания фото влюбленных	54	/promty-dlya-foto-vlyublennykh/	programmatic_L1	audience_tag	vlyublennykh	wordstat_top_queries (1).csv
промт для ии фото для резюме	54	/foto-na-rezume/	programmatic_L1	doc_task_tag	na_rezume	wordstat_top_queries (1).csv
промт для фото в стиле gta	54	/stil/gta/	programmatic_L1	style_tag	gta	wordstat_top_queries (1).csv
промт для ии фото love is	54	/stil/love-is/	programmatic_L1	style_tag	love_is	wordstat_top_queries (1).csv
промт для фото папа с дочкой	54	/promty-dlya-foto-s-papoy/	programmatic_L1	audience_tag	s_papoy	wordstat_top_queries (1).csv
промт для генерации фото подруг	53	/promty-dlya-sozdaniya-foto/	static_hub	intent_action=sozdanie	intent_action=sozdanie	wordstat_top_queries (1).csv
промт для создания весеннего фото	53	/vesennie/	programmatic_L1	object_tag	vesna	wordstat_top_queries (1).csv
промт фото ии с котом	53	/s-kotom/	programmatic_L1	object_tag	s_kotom	wordstat_top_queries (1).csv
промты для максимально реалистичных фото	53	/stil/realistichnoe/	programmatic_L1	style_tag	realistichnoe	wordstat_top_queries (1).csv
семейная фото промт чб	53	/promty-dlya-semejnogo-foto/cherno-beloe/	programmatic_L2	audience_tag+style_tag	semya+cherno_beloe	wordstat_top_queries (1).csv
промт для генерации фото со знаменитостью	53	/so-znamenitostyu/	programmatic_L1	object_tag	so_znamenitostyu	wordstat_top_queries (1).csv
промт для фото для 3 девушек	53	/promty-dlya-foto-devushki/	programmatic_L1	audience_tag	devushka	wordstat_top_queries (1).csv
промты для генерации парных фото	52	/promty-dlya-foto-par/	programmatic_L1	audience_tag	para	wordstat_top_queries (1).csv
