new_landing_url	menu_group	category	subcategory	page_level	query_count	total_volume	sample_query_1	sample_query_2	sample_query_3	sample_query_4	sample_query_5
/sobytiya/novyj-god/	События	Новый год	Общие	L1	8	255	промт фото новогодняя	промт фото новый год	промт для создания новогодних фото	создать новогоднее фото промт	промт на фото в новогоднем стиле
/instrumenty/nano-banana/	Инструменты	Nano Banana	Общие	L1	6	250	промты для генерации фото nano banana	нано банана сделать фото промт	промты для обработки фото в нано банана	промты для обработки фото nano banana	промты для генерации фото nana banana
/stil/disney/	Стили	Disney	Общие	L1	2	245	промт фото дисней	промт на фото в стиле дисней			
/instrumenty/gemini/	Инструменты	Gemini	Общие	L1	7	243	промты для обработки фото gemini	промт для улучшения качества фото gemini	промт для генерации фото gemini	промты для gemini для создания фото	промт для gemini переделка фото
/promty-dlya-zameny-lica/	Сценарии	Замена лица	Общие	L1	4	237	промт заменить лица на фото	промт чтобы добавить человека на фото	промт убрать человека с фото	промт чтобы заменить человека на фото	
/promty-dlya-obrabotki-foto/krasivye/	Сценарии	Обработка фото	Красивые промты	L2	5	229	промт для красивой обработки фото	крутые промты для обработки фото	интересные промты для обработки фото	крутые промты для редактирования фото	классные промты для обработки фото
/promty-dlya-foto-muzhchiny/v-forme/	Люди и отношения	Мужчины	В форме	L2	2	223	промт для фото мужчина в форме	промт для фото мужчины в военной форме			
/promty-dlya-obrabotki-foto/na-russkom/	Сценарии	Обработка фото	Промты на русском	L2	1	213	промты для обработки фото на русском				
/sobytiya/23-fevralya/otkrytka/	События	23 февраля	Открытка	L2	1	209	промт для фото открытки с 23 февраля				
/s-koronoj/	Сцены и объекты	С короной	Общие	L1	4	206	промт для фото с короной	промт для создания фото с короной	промты для ии фото с короной	тренд фото с короной промт	
/promty-dlya-foto-devushki/s-cvetami/	Люди и отношения	Девушки	С цветами	L2	3	192	промты для фото девушки с цветами	промт на фото девушка с тюльпанами	промт фото девушки миллион роз		
/promty-dlya-foto-vlyublennykh/14-fevralya/	Люди и отношения	Влюбленные	14 февраля	L2	4	188	промт для фото на день влюбленных	промты для ии фото день влюбленных	бесплатные промты для фото на день влюбленных	промт для создания фото на день влюбленных	
/promty-dlya-foto-muzhchiny/delovoe/	Люди и отношения	Мужчины	Деловое	L2	4	186	промт для делового фото мужчины	промт для фото мужчины в деловом костюме	промт для мужского делового фото	промт для ии фото делового мужского	
/promty-dlya-foto-s-sestroy/	Люди и отношения	С сестрой	Общие	L1	3	170	промт для фото с сестрой	промт для фото двух сестер	промт для фото 2 сестер		
/promty-dlya-foto-muzhchiny/v-kostyume/	Люди и отношения	Мужчины	В костюме	L2	1	159	промт для фото мужчины в костюме				
/promty-dlya-semejnogo-foto/cherno-beloe/	Люди и отношения	Семья	Черно-белое	L2	4	153	промт для черно белого семейного фото	семейная фото промт чб	промт на черно белое фото семьи	семейная фотосессия нейросеть черно белое фото промт	
/stil/kollazh/	Стили	kollazh	Общие	L1	4	153	промт на коллаж из фото	промт для коллажа из 3 фото	промт на коллаж из трех фото	промт для ии коллаж из трех фото	
/promty-dlya-foto-s-muzhem/v-forme/	Люди и отношения	С мужем	В форме	L2	1	146	промт для фото с мужем военным				
/promty-dlya-detskih-foto/maslenica/	Люди и отношения	Дети	Масленица	L2	3	144	промт для фото ребенка на масленицу	промты для ии для фото ребенка масленица	промт для детского фото на масленицу		
/promty-dlya-foto-devushki/portret/	Люди и отношения	Девушки	Портрет	L2	4	141	промты для фото девушки портрет	промт для портретного фото женщины	промт для портретного фото девушки	промты для фото девушки студийный портрет	
/promty-dlya-foto-devushki/studiynoe/	Люди и отношения	Девушки	Студийное	L2	4	134	промт для студийного фото девушки	промты для фото девушки в студии	промт на фото женщины в студийном стиле	промты на студийные фото девушек обычные	
/promty-dlya-foto-devushki/delovoe/	Люди и отношения	Девушки	Деловое	L2	2	119	промт для делового фото женщины	промт для делового фото девушки			
/promty-dlya-foto-devushki/v-kostyume/	Люди и отношения	Девушки	В костюме	L2	1	113	промт для фото девушки в костюме				
/stil/delovoe/v-kostyume/	Стили	Деловое	В костюме	L2	1	111	промт для фото в деловом костюме				
/stil/polaroid/so-znamenitostyu/	Стили	Полароид	Со знаменитостью	L2	4	111	промт для фото со знаменитостью полароид	промт на фото с знаменитостью полароида	промт для создания фото со знаменитостью полароид	фото с кумиром на полароид промт	
/promty-dlya-foto-pokoleniy/portret/	Люди и отношения	Поколения	Портрет	L2	2	109	промт для фото портрет поколений	промт на объединение фото в портрет поколений			
/promty-dlya-foto-muzhchiny/cherno-beloe/	Люди и отношения	Мужчины	Черно-белое	L2	1	95	промт мужчина черно белое фото				
/sobytiya/23-fevralya/v-forme/	События	23 февраля	В форме	L2	2	93	промт для фото 23 февраля военный	промт с 23 февраля по фото сво			
/promty-dlya-detskih-foto/cherno-beloe/	Люди и отношения	Дети	Черно-белое	L2	1	92	промт черно белое фото с ребенком				
/promty-dlya-foto-muzhchiny/studiynoe/	Люди и отношения	Мужчины	Студийное	L2	1	90	промт студийное фото мужчина				
/promty-dlya-uluchsheniya-foto/gotovye/	Сценарии	Улучшение фото	Готовые промты	L2	2	87	готовый промт для улучшения фото	готовый промт для улучшения качества фото			
/promty-dlya-detskih-foto/23-fevralya/	Люди и отношения	Дети	23 февраля	L2	2	77	промт для фото ребенка к 23 февраля	промт для детского фото на 23 февраля			
/promty-dlya-foto-devushki/zimnie/	Люди и отношения	Девушки	Зима	L2	1	75	промты для фото девушки зимние				
/promty-dlya-obrabotki-foto/luchshie/	Сценарии	Обработка фото	Лучшие промты	L2	3	73	лучшие промты для обработки фото	лучшие промты для редактирования фото	топ промтов для обработки фото		
/promty-dlya-foto-muzhchiny/den-rozhdeniya/	Люди и отношения	Мужчины	День рождения	L2	2	69	промт для фото на день рождения мужчине	промт для фото 70 лет мужчине			
/promty-dlya-obrabotki-foto/podrobnye/	Сценарии	Обработка фото	Подробные промты	L2	1	67	подробный промт для обработки фото				
/promty-dlya-foto-muzhchiny/realistichnoe/	Люди и отношения	Мужчины	Реалистичное	L2	1	66	промты для реалистичных фото мужчин				
/promty-dlya-foto-s-parnem/v-zerkale/	Люди и отношения	С парнем	В зеркале	L2	1	61	промт для фото в зеркале с парнем				
/promty-dlya-foto-par/cherno-beloe/	Люди и отношения	Пары	Черно-белое	L2	2	60	чб промт фото пар	промты для парных чб фото			
/sobytiya/novyj-god/otkrytka/	События	Новый год	Открытка	L2	2	57	промт фото новогодняя открытка	фото в стиле новогодней открытки промт			
/promty-dlya-foto-muzhchiny/s-mashinoy/	Люди и отношения	Мужчины	С машиной	L2	1	56	промты для фото мужчины с машиной				
/promty-dlya-foto-devushki/v-forme/	Люди и отношения	Девушки	В форме	L2	2	51	промт на фото военный с девушкой	промт на генерацию фото военные с девушкой			
/promty-dlya-foto-devushki/23-fevralya/	Люди и отношения	Девушки	23 февраля	L2	1	50	промт фото девушки к 23 февраля				
/promty-dlya-foto-muzhchiny/zimnie/	Люди и отношения	Мужчины	Зима	L2	3	50	зимний промт фото для мужчин	промт на мужское фото на горнолыжном курорте	промт ии мужское фото на горнолыжном курорте		
/promty-dlya-semejnogo-foto/studiynoe/	Люди и отношения	Семья	Студийное	L2	2	50	промт для студийного семейного фото	промт для семейного фото в студии			
/sobytiya/novyj-god/sovetskoe/	События	Новый год	Советское	L2	4	50	промты новогодние советские фото	промт новогоднее фото ссср	новогоднее фото в советском стиле промт	промт новогоднее фото в стиле ссср	
/sobytiya/23-fevralya/sovetskoe/	События	23 февраля	Советское	L2	1	49	промт на фото советское 23 февраля				
/sobytiya/8-marta/otkrytka/	События	8 марта	Открытка	L2	1	48	промт открытка на 8 марта по фото				
/promty-dlya-foto-devochki/maslenica/	Люди и отношения	Девочки	Масленица	L2	1	44	промт фото девочка масленица				
/promty-dlya-detskih-foto/14-fevralya/	Люди и отношения	Дети	14 февраля	L2	1	42	промт для фото ребенка на 14 февраля				
/promty-dlya-foto-malchika/den-rozhdeniya/	Люди и отношения	Мальчики	День рождения	L2	1	40	промт для фото на день рождения мальчику				
/promty-dlya-foto-devushki/v-polnyj-rost/	Люди и отношения	Девушки	В полный рост	L2	1	38	промт для фото девушки в полный рост				
/promty-dlya-foto-devushki/vesennie/	Люди и отношения	Девушки	Весна	L2	1	35	промт для весеннего фото для девушки				
/promty-dlya-sozdaniya-foto/luchshie/	Сценарии	Создание фото	Лучшие промты	L2	2	34	топ промтов для генерации фото	популярные промты для создания фото			
/promty-dlya-foto-s-parnem/cherno-beloe/	Люди и отношения	С парнем	Черно-белое	L2	2	33	промт фото черно белое с парнем	промт для чб фото с парнем			
/promty-dlya-semejnogo-foto/portret/	Люди и отношения	Семья	Портрет	L2	1	33	промт на фото семейный портрет				
/promty-dlya-foto-muzhchiny/so-znamenitostyu/	Люди и отношения	Мужчины	Со знаменитостью	L2	1	30	промт фото мужчины с путиным				
/promty-dlya-foto-muzhchiny/portret/	Люди и отношения	Мужчины	Портрет	L2	2	29	промт для портретного фото мужчины	мужские портретные фото ии промты			
/promty-dlya-foto-pokoleniy/v-profil/	Люди и отношения	Поколения	В профиль	L2	1	29	промт фото поколений в профиль				
/promty-dlya-foto-devushki/foto-na-avatarku/	Люди и отношения	Девушки	На аватарку	L2	1	24	промт для фото девушки на аватарку				
/promty-dlya-foto-devushki/retro/	Люди и отношения	Девушки	Ретро	L2	1	22	промты для ретро фото девушки				
/promty-dlya-foto-devushki/s-kotom/	Люди и отношения	Девушки	С котом	L2	1	21	промт фото девушки с кошкой				
/promty-dlya-detskih-foto/8-marta/	Люди и отношения	Дети	8 марта	L2	1	20	промт на фото ребенка к 8 марта				
/promty-dlya-foto-devushki/s-koronoj/	Люди и отношения	Девушки	С короной	L2	1	20	промт для фото девушка с короной				
/promty-dlya-foto-par/realistichnoe/	Люди и отношения	Пары	Реалистичное	L2	1	18	промт для пар реалистичные фото				
/promty-dlya-uluchsheniya-foto/primery/	Сценарии	Улучшение фото	Примеры промтов	L2	1	18	промт для улучшения фото примеры				
/stil/realistichnoe/s-kotom/	Стили	Реалистичное	С котом	L2	1	18	фотореалистичное фото кошки и человека промт				
/promty-dlya-semejnogo-foto/23-fevralya/	Люди и отношения	Семья	23 февраля	L2	1	17	промты для 23 февраля семейная фото				
/promty-dlya-obrabotki-foto/shablony/	Сценарии	Обработка фото	Шаблоны промтов	L2	1	16	шаблоны промтов для обработки фото				
/promty-dlya-foto-muzhchiny/foto-na-pasport/	Люди и отношения	Мужчины	На паспорт	L2	1	14	промт для фото на паспорт мужчине				
/promty-dlya-foto-s-pitomcem/studiynoe/	Люди и отношения	С питомцем	Студийное	L2	1	13	промт студийное фото питомца				
/stil/cherno-beloe/s-kotom/	Стили	Черно-белое	С котом	L2	1	12	промт черно белое фото с котом				
/promty-dlya-detskih-foto/novyj-god/	Люди и отношения	Дети	Новый год	L2	1	11	промты новогодние детские фото				
/promty-dlya-detskih-foto/so-znamenitostyu/	Люди и отношения	Дети	Со знаменитостью	L2	1	11	промт для фото ребенка с чебурашкой				
/promty-dlya-foto-pokoleniy/cherno-beloe/	Люди и отношения	Поколения	Черно-белое	L2	1	11	промт портрет поколений черно белое фото				
/stil/studiynoe/v-forme/	Стили	Студийное	В форме	L2	1	11	промты для фото с военным в студии				
/promty-dlya-semejnogo-foto/novyj-god/	Люди и отношения	Семья	Новый год	L2	1	10	новогодний промт семейное фото				
/promty-dlya-foto-devushki/s-sobakoj/	Люди и отношения	Девушки	С собакой	L2	1	9	фото девушки с доберманом промт				
/promty-dlya-foto-s-synom/cherno-beloe/	Люди и отношения	С сыном	Черно-белое	L2	1	9	промт на фото с сыном чб				
/stil/selfi/na-more/	Стили	Селфи	На море	L2	1	9	промты для ии фото селфи на пляже				
/sobytiya/8-marta/retro/	События	8 марта	Ретро	L2	1	8	винтажное фото на 8 марта промт				
/promty-dlya-foto-par/14-fevralya/	Люди и отношения	Пары	14 февраля	L2	1	7	промт на совместное фото на день влюбленных				
/promty-dlya-foto-par/v-forme/	Люди и отношения	Пары	В форме	L2	1	7	промт для совместного фото с сво				
/sobytiya/svadba/zimnie/	События	Свадьба	Зима	L2	1	7	промты для свадебных зимних фото				
/promty-dlya-foto-devushki/s-mashinoy/	Люди и отношения	Девушки	С машиной	L2	1	6	промт для фото женский с машиной текст				
/sobytiya/den-rozhdeniya/v-forme/	События	День рождения	В форме	L2	1	6	промт на фото военного в день рождение				
/stil/cherno-beloe/s-sobakoj/	Стили	Черно-белое	С собакой	L2	1	6	промт для фото с собакой в чб				
/promty-dlya-foto-s-babushkoy/portret/	Люди и отношения	С бабушкой	Портрет	L2	1	5	промт фото поколения портрет бабушка мать дочт				
