query	volume	landing_url	page_type	matched_dimensions	matched_values	source_file
промт gpt фото студийное	32	/stil/studiynoe/	programmatic_L1	style_tag	studiynoe	wordstat_top_queries (1).csv
промты для нейросети фото с мужем	31	/promty-dlya-foto-s-muzhem/	programmatic_L1	audience_tag	s_muzhem	wordstat_top_queries (1).csv
фото в стиле гта нейросеть промт	31	/stil/gta/	programmatic_L1	style_tag	gta	wordstat_top_queries (1).csv
промт для ии фото на полароид	31	/stil/polaroid/	programmatic_L1	style_tag	polaroid	wordstat_top_queries (1).csv
промт для генерации фото в стиле аниме	31	/stil/anime/	programmatic_L1	style_tag	anime	wordstat_top_queries (1).csv
промт на фото в машине с парнем	31	/promty-dlya-foto-s-parnem/	programmatic_L1	audience_tag	s_parnem	wordstat_top_queries (1).csv
реалистичный промт для генерации похожего фото	31	/stil/realistichnoe/	programmatic_L1	style_tag	realistichnoe	wordstat_top_queries (1).csv
пример промта для генерации похожего фото	31	/promty-dlya-sozdaniya-foto/	static_hub	intent_action=sozdanie	intent_action=sozdanie	wordstat_top_queries (1).csv
промт для генерации фото в стиле гта	31	/stil/gta/	programmatic_L1	style_tag	gta	wordstat_top_queries (1).csv
промт для совместного фото с мужем	31	/promty-dlya-foto-par/	programmatic_L1	audience_tag	para	wordstat_top_queries (1).csv
промт для фото в стиле пиксар	31	/stil/piksar/	programmatic_L1	style_tag	piksar	wordstat_top_queries (1).csv
промт фото мамы и взрослой дочки	31	/promty-dlya-foto-s-mamoy/	programmatic_L1	audience_tag	s_mamoy	wordstat_top_queries (1).csv
зимний промт фото для мужчин	31	/promty-dlya-foto-muzhchiny/zimnie/	programmatic_L2	audience_tag+object_tag	muzhchina+zima	wordstat_top_queries (1).csv
промт для зимней фото ии	30	/zimnie/	programmatic_L1	object_tag	zima	wordstat_top_queries (1).csv
промт на фото семью боком	30	/promty-dlya-semejnogo-foto/v-profil/	programmatic_L2	audience_tag+object_tag	semya+v_profil	wordstat_top_queries (1).csv
промт фото в мимозах	30	/s-cvetami/	programmatic_L1	object_tag	s_cvetami	wordstat_top_queries (1).csv
промт фото мужчины с путиным	30	/promty-dlya-foto-muzhchiny/so-znamenitostyu/	programmatic_L2	audience_tag+object_tag	muzhchina+so_znamenitostyu	wordstat_top_queries (1).csv
промт для ии фото в стиле гта	30	/stil/gta/	programmatic_L1	style_tag	gta	wordstat_top_queries (1).csv
промты для нейросети для обработки фото мужчины	30	/promty-dlya-foto-muzhchiny/	programmatic_L1	audience_tag	muzhchina	wordstat_top_queries (1).csv
промты для создания фото ии мужчины	30	/promty-dlya-foto-muzhchiny/	programmatic_L1	audience_tag	muzhchina	wordstat_top_queries (1).csv
промт фото с звездой	30	/so-znamenitostyu/	programmatic_L1	object_tag	so_znamenitostyu	wordstat_top_queries (1).csv
промт для фото в стиле полароид	29	/stil/polaroid/	programmatic_L1	style_tag	polaroid	wordstat_top_queries (1).csv
ии сделать фото по промту бесплатно	29	/promty-dlya-sozdaniya-foto/	static_hub	intent_action=sozdanie	intent_action=sozdanie	wordstat_top_queries (1).csv
промты для нейросети для совместного фото	29	/promty-dlya-foto-par/	programmatic_L1	audience_tag	para	wordstat_top_queries (1).csv
промт для фото двух мужчин	29	/promty-dlya-foto-muzhchiny/	programmatic_L1	audience_tag	muzhchina	wordstat_top_queries (1).csv
готовый промт для улучшения качества фото	29	/promty-dlya-uluchsheniya-foto/	static_hub	intent_action=uluchshenie	intent_action=uluchshenie	wordstat_top_queries (1).csv
промты для gemini для создания фото	29	/promty-dlya-sozdaniya-foto/	static_hub	intent_action=sozdanie	intent_action=sozdanie	wordstat_top_queries (1).csv
промт для регенерации фото	29	/promty-dlya-sozdaniya-foto/	static_hub	intent_action=sozdanie	intent_action=sozdanie	wordstat_top_queries (1).csv
готовые промты для фото мужчин со спецэффектами	29	/promty-dlya-foto-muzhchiny/	programmatic_L1	audience_tag	muzhchina	wordstat_top_queries (1).csv
промты готовые для женских фото	29	/promty-dlya-foto-devushki/	programmatic_L1	audience_tag	devushka	wordstat_top_queries (1).csv
зимние промты для нейросети для фото	29	/zimnie/	programmatic_L1	object_tag	zima	wordstat_top_queries (1).csv
промт фото поколений в профиль	29	/promty-dlya-foto-pokoleniy/v-profil/	programmatic_L2	audience_tag+object_tag	pokoleniy+v_profil	wordstat_top_queries (1).csv
мужские крутые промты для фото	29	/promty-dlya-foto-muzhchiny/	programmatic_L1	audience_tag	muzhchina	wordstat_top_queries (1).csv
промт для gpt фото с мамой	28	/promty-dlya-foto-s-mamoy/	programmatic_L1	audience_tag	s_mamoy	wordstat_top_queries (1).csv
промт на фото отца и сына	28	/promty-dlya-foto-s-papoy/	programmatic_L1	audience_tag	s_papoy	wordstat_top_queries (1).csv
промты для генерирования фото	28	/promty-dlya-sozdaniya-foto/	static_hub	intent_action=sozdanie	intent_action=sozdanie	wordstat_top_queries (1).csv
готовый промт для генерации фото девушки	28	/promty-dlya-foto-devushki/	programmatic_L1	audience_tag	devushka	wordstat_top_queries (1).csv
промты для совместных фото пары	28	/promty-dlya-foto-par/	programmatic_L1	audience_tag	para	wordstat_top_queries (1).csv
промт для фото на годовщину свадьбы	28	/sobytiya/svadba/	programmatic_L1	occasion_tag	svadba	wordstat_top_queries (1).csv
промт для нейросети фото в студии	28	/stil/studiynoe/	programmatic_L1	style_tag	studiynoe	wordstat_top_queries (1).csv
промт для генерации фото с питомцем	28	/promty-dlya-foto-s-pitomcem/	programmatic_L1	audience_tag	s_pitomcem	wordstat_top_queries (1).csv
промт улучшить старое фото	28	/promty-dlya-restavracii-foto/	static_hub	intent_action=restavratsiya	intent_action=restavratsiya	wordstat_top_queries (1).csv
сгенерировать фото по промту бесплатно онлайн	27	/promty-dlya-sozdaniya-foto/	static_hub	intent_action=sozdanie	intent_action=sozdanie	wordstat_top_queries (1).csv
промт для фото с михаилом кругом	27	/so-znamenitostyu/	programmatic_L1	object_tag	so_znamenitostyu	wordstat_top_queries (1).csv
промт фото мама дочка и сын	27	/promty-dlya-foto-s-mamoy/	programmatic_L1	audience_tag	s_mamoy	wordstat_top_queries (1).csv
промт для фото с бмв	27	/s-mashinoy/	programmatic_L1	object_tag	s_mashinoy	wordstat_top_queries (1).csv
промт фото черно белое с парнем	27	/promty-dlya-foto-s-parnem/cherno-beloe/	programmatic_L2	audience_tag+style_tag	s_parnem+cherno_beloe	wordstat_top_queries (1).csv
промт для нейросети фото весенние	27	/vesennie/	programmatic_L1	object_tag	vesna	wordstat_top_queries (1).csv
промты готовые для детских фото	27	/promty-dlya-detskih-foto/	programmatic_L1	audience_tag	detskie	wordstat_top_queries (1).csv
промты для ии фото к 14 февраля	27	/sobytiya/14-fevralya/	programmatic_L1	occasion_tag	14_fevralya	wordstat_top_queries (1).csv
промты для обработки фото nano banana	26	/promty-dlya-obrabotki-foto/	static_hub	intent_action=obrabotka	intent_action=obrabotka	wordstat_top_queries (1).csv
готовые промты для редактирования фото	26	/promty-dlya-obrabotki-foto/	static_hub	intent_action=obrabotka	intent_action=obrabotka	wordstat_top_queries (1).csv
промт фотореалистичное фото в темной студии	26	/stil/realistichnoe/	programmatic_L1	style_tag	realistichnoe	wordstat_top_queries (1).csv
промт для фото женщины в возрасте	26	/promty-dlya-foto-devushki/	programmatic_L1	audience_tag	devushka	wordstat_top_queries (1).csv
промт для ии фото на др	26	/sobytiya/den-rozhdeniya/	programmatic_L1	occasion_tag	den_rozhdeniya	wordstat_top_queries (1).csv
промты для обработки фото авто	26	/s-mashinoy/	programmatic_L1	object_tag	s_mashinoy	wordstat_top_queries (1).csv
промт чтобы сделать реалистичное фото	26	/stil/realistichnoe/	programmatic_L1	style_tag	realistichnoe	wordstat_top_queries (1).csv
промт для генерации фото поколений	26	/promty-dlya-foto-pokoleniy/	programmatic_L1	audience_tag	pokoleniy	wordstat_top_queries (1).csv
промт для ии советское фото	26	/stil/sovetskoe/	programmatic_L1	style_tag	sovetskoe	wordstat_top_queries (1).csv
промт для портретного фото женщины	25	/promty-dlya-foto-devushki/portret/	programmatic_L2	audience_tag+style_tag	devushka+portret	wordstat_top_queries (1).csv
промты для генерации совместных фото	25	/promty-dlya-foto-par/	programmatic_L1	audience_tag	para	wordstat_top_queries (1).csv
готовые промты для создания фото в gpt	25	/promty-dlya-sozdaniya-foto/	static_hub	intent_action=sozdanie	intent_action=sozdanie	wordstat_top_queries (1).csv
промт для корпоративного фото	25	/stil/delovoe/	programmatic_L1	style_tag	delovoe	wordstat_top_queries (1).csv
промты для студийных фото черно белые	25	/stil/cherno-beloe/	programmatic_L1	style_tag	cherno_beloe	wordstat_top_queries (1).csv
промт для улучшения лица на фото	25	/promty-dlya-uluchsheniya-foto/	static_hub	intent_action=uluchshenie	intent_action=uluchshenie	wordstat_top_queries (1).csv
промт для nano banana фото ребенка	25	/promty-dlya-detskih-foto/	programmatic_L1	audience_tag	detskie	wordstat_top_queries (1).csv
промт для генерации фото на 14 февраля	25	/sobytiya/14-fevralya/	programmatic_L1	occasion_tag	14_fevralya	wordstat_top_queries (1).csv
промт для фото в старом стиле	25	/stil/retro/	programmatic_L1	style_tag	retro	wordstat_top_queries (1).csv
промт для обработки фото без изменения	25	/promty-dlya-obrabotki-foto/	static_hub	intent_action=obrabotka	intent_action=obrabotka	wordstat_top_queries (1).csv
промт создание интересное фото	25	/promty-dlya-sozdaniya-foto/	static_hub	intent_action=sozdanie	intent_action=sozdanie	wordstat_top_queries (1).csv
промт для фотосессии нейросети для семейного фото	25	/promty-dlya-semejnogo-foto/	programmatic_L1	audience_tag	semya	wordstat_top_queries (1).csv
изменить фото по промту бесплатно	25	/promty-dlya-obrabotki-foto/	static_hub	intent_action=obrabotka	intent_action=obrabotka	wordstat_top_queries (1).csv
готовые промты для создания фото ии	25	/promty-dlya-sozdaniya-foto/	static_hub	intent_action=sozdanie	intent_action=sozdanie	wordstat_top_queries (1).csv
готовые промты для реалистичных фото	25	/stil/realistichnoe/	programmatic_L1	style_tag	realistichnoe	wordstat_top_queries (1).csv
промт чтобы заменить человека на фото	24	/promty-dlya-zameny-lica/	static_hub	intent_action=zamena_lica	intent_action=zamena_lica	wordstat_top_queries (1).csv
промты для генерации фото chatgpt	24	/promty-dlya-sozdaniya-foto/	static_hub	intent_action=sozdanie	intent_action=sozdanie	wordstat_top_queries (1).csv
промт для создания фото лов ис	24	/stil/love-is/	programmatic_L1	style_tag	love_is	wordstat_top_queries (1).csv
промт фото детей с цветами	24	/s-cvetami/	programmatic_L1	object_tag	s_cvetami	wordstat_top_queries (1).csv
промт для фото в стиле лов ис	24	/stil/love-is/	programmatic_L1	style_tag	love_is	wordstat_top_queries (1).csv
промт для мужского делового фото	24	/promty-dlya-foto-muzhchiny/delovoe/	programmatic_L2	audience_tag+style_tag	muzhchina+delovoe	wordstat_top_queries (1).csv
примеры промтов для семейного фото	24	/promty-dlya-semejnogo-foto/	programmatic_L1	audience_tag	semya	wordstat_top_queries (1).csv
промт для нейросети свадебное фото	24	/sobytiya/svadba/	programmatic_L1	occasion_tag	svadba	wordstat_top_queries (1).csv
промт для генерации фото на др	24	/sobytiya/den-rozhdeniya/	programmatic_L1	occasion_tag	den_rozhdeniya	wordstat_top_queries (1).csv
промты для фото в нейросети детские	24	/promty-dlya-detskih-foto/	programmatic_L1	audience_tag	detskie	wordstat_top_queries (1).csv
промт для фото с чебурашкой на льду	24	/so-znamenitostyu/	programmatic_L1	object_tag	so_znamenitostyu	wordstat_top_queries (1).csv
промт для фото любовь это	24	/stil/love-is/	programmatic_L1	style_tag	love_is	wordstat_top_queries (1).csv
промт для обработки семейного фото	24	/promty-dlya-semejnogo-foto/	programmatic_L1	audience_tag	semya	wordstat_top_queries (1).csv
промт на фото лыжи	24	/zimnie/	programmatic_L1	object_tag	zima	wordstat_top_queries (1).csv
промт для редактирования фото чат gpt	24	/promty-dlya-obrabotki-foto/	static_hub	intent_action=obrabotka	intent_action=obrabotka	wordstat_top_queries (1).csv
промт для фото девушки на аватарку	24	/promty-dlya-foto-devushki/foto-na-avatarku/	programmatic_L2	audience_tag+doc_task_tag	devushka+na_avatarku	wordstat_top_queries (1).csv
ии генератор фото по промту	23	/promty-dlya-sozdaniya-foto/	static_hub	intent_action=sozdanie	intent_action=sozdanie	wordstat_top_queries (1).csv
промт для автомобиля генерация фото	23	/s-mashinoy/	programmatic_L1	object_tag	s_mashinoy	wordstat_top_queries (1).csv
промт для фото семьи поколений	23	/promty-dlya-semejnogo-foto/	programmatic_L1	audience_tag	semya	wordstat_top_queries (1).csv
промт фото ко дню святого валентина ии	23	/sobytiya/14-fevralya/	programmatic_L1	occasion_tag	14_fevralya	wordstat_top_queries (1).csv
промт для нейросети для фото автомобиля	23	/s-mashinoy/	programmatic_L1	object_tag	s_mashinoy	wordstat_top_queries (1).csv
смешные промты для создания фото	23	/promty-dlya-sozdaniya-foto/	static_hub	intent_action=sozdanie	intent_action=sozdanie	wordstat_top_queries (1).csv
промт для фото пары в студии	23	/stil/studiynoe/	programmatic_L1	style_tag	studiynoe	wordstat_top_queries (1).csv
промт для фото со знаменитостью на улице	23	/so-znamenitostyu/	programmatic_L1	object_tag	so_znamenitostyu	wordstat_top_queries (1).csv
сделать фото с котом промт	23	/s-kotom/	programmatic_L1	object_tag	s_kotom	wordstat_top_queries (1).csv
промт фото крупным планом для двоих	23	/promty-dlya-foto-par/	programmatic_L1	audience_tag	para	wordstat_top_queries (1).csv
промт для фото с доберманом	23	/s-sobakoj/	programmatic_L1	object_tag	s_sobakoy	wordstat_top_queries (1).csv
готовые промты для генерации фото в нейросети	23	/promty-dlya-sozdaniya-foto/	static_hub	intent_action=sozdanie	intent_action=sozdanie	wordstat_top_queries (1).csv
промт для ии сделать фото на паспорт	23	/foto-na-pasport/	programmatic_L1	doc_task_tag	na_pasport	wordstat_top_queries (1).csv
промты для нано банано реалистичных фото	23	/stil/realistichnoe/	programmatic_L1	style_tag	realistichnoe	wordstat_top_queries (1).csv
промты для ретро фото девушки	22	/promty-dlya-foto-devushki/retro/	programmatic_L2	audience_tag+style_tag	devushka+retro	wordstat_top_queries (1).csv
промт для детского фото на масленицу	22	/promty-dlya-detskih-foto/maslenica/	programmatic_L2	audience_tag+occasion_tag	detskie+maslenica	wordstat_top_queries (1).csv
примеры промтов для создания фото в нейросети	22	/promty-dlya-sozdaniya-foto/	static_hub	intent_action=sozdanie	intent_action=sozdanie	wordstat_top_queries (1).csv
промт для генерации фото к 8 марта	22	/sobytiya/8-marta/	programmatic_L1	occasion_tag	8_marta	wordstat_top_queries (1).csv
бесплатные промты для фото на день влюбленных	22	/promty-dlya-foto-vlyublennykh/14-fevralya/	programmatic_L2	audience_tag+occasion_tag	vlyublennykh+14_fevralya	wordstat_top_queries (1).csv
промты для ии фото аниме	22	/stil/anime/	programmatic_L1	style_tag	anime	wordstat_top_queries (1).csv
промт для семейного фото из 4 человек	22	/promty-dlya-semejnogo-foto/	programmatic_L1	audience_tag	semya	wordstat_top_queries (1).csv
промт на фото гта сан андреас	22	/stil/gta/	programmatic_L1	style_tag	gta	wordstat_top_queries (1).csv
редактор фото по промту бесплатно	22	/promty-dlya-obrabotki-foto/	static_hub	intent_action=obrabotka	intent_action=obrabotka	wordstat_top_queries (1).csv
промты для нано банана студийные фото	22	/stil/studiynoe/	programmatic_L1	style_tag	studiynoe	wordstat_top_queries (1).csv
промты для фото человека с машиной	22	/s-mashinoy/	programmatic_L1	object_tag	s_mashinoy	wordstat_top_queries (1).csv
промт для обработки фото в стиле гта	22	/stil/gta/	programmatic_L1	style_tag	gta	wordstat_top_queries (1).csv
промт для весеннего фото с тюльпанами	21	/s-cvetami/	programmatic_L1	object_tag	s_cvetami	wordstat_top_queries (1).csv
нужен промт для обработки фото	21	/promty-dlya-obrabotki-foto/	static_hub	intent_action=obrabotka	intent_action=obrabotka	wordstat_top_queries (1).csv
промты для нейросети для обработки фото детей	21	/promty-dlya-obrabotki-foto/	static_hub	intent_action=obrabotka	intent_action=obrabotka	wordstat_top_queries (1).csv
промты для chatgpt для фото девушки	21	/promty-dlya-foto-devushki/	programmatic_L1	audience_tag	devushka	wordstat_top_queries (1).csv
генерация фото по промту бесплатно онлайн	21	/promty-dlya-sozdaniya-foto/	static_hub	intent_action=sozdanie	intent_action=sozdanie	wordstat_top_queries (1).csv
промт для фото новорожденного ребенка	21	/promty-dlya-detskih-foto/	programmatic_L1	audience_tag	detskie	wordstat_top_queries (1).csv
создать фото по промту в ии	21	/promty-dlya-sozdaniya-foto/	static_hub	intent_action=sozdanie	intent_action=sozdanie	wordstat_top_queries (1).csv
промт чтобы сделать фото со знаменитостью	21	/so-znamenitostyu/	programmatic_L1	object_tag	so_znamenitostyu	wordstat_top_queries (1).csv
промт для генерации идентичного фото	21	/promty-dlya-sozdaniya-foto/	static_hub	intent_action=sozdanie	intent_action=sozdanie	wordstat_top_queries (1).csv
промт для фото чат gpt фотосессия	21	/promty-dlya-fotosessii/	static_hub	intent_action=fotosessiya	intent_action=fotosessiya	wordstat_top_queries (1).csv
промт для фотосессии нейросети по фото	21	/promty-dlya-fotosessii/	static_hub	intent_action=fotosessiya	intent_action=fotosessiya	wordstat_top_queries (1).csv
как сделать фото поколений промт	21	/promty-dlya-foto-pokoleniy/	programmatic_L1	audience_tag	pokoleniy	wordstat_top_queries (1).csv
промт для открытки love is по фото	21	/stil/love-is/	programmatic_L1	style_tag	love_is	wordstat_top_queries (1).csv
промты для нано банана для делового фото	21	/stil/delovoe/	programmatic_L1	style_tag	delovoe	wordstat_top_queries (1).csv
промт для gemini для фото для девушки	21	/promty-dlya-foto-devushki/	programmatic_L1	audience_tag	devushka	wordstat_top_queries (1).csv
промт для фото в стиле мультика	21	/stil/multyashnoe/	programmatic_L1	style_tag	multyashnoe	wordstat_top_queries (1).csv
промт для фото нейросети с подругой	21	/promty-dlya-foto-s-podrugoy/	programmatic_L1	audience_tag	s_podrugoy	wordstat_top_queries (1).csv
супер промт восстановление старого фото	21	/promty-dlya-restavracii-foto/	static_hub	intent_action=restavratsiya	intent_action=restavratsiya	wordstat_top_queries (1).csv
промт для создания фото с короной	21	/s-koronoj/	programmatic_L1	object_tag	s_koronoy	wordstat_top_queries (1).csv
промт для фото в стиле заставки гта	21	/stil/gta/	programmatic_L1	style_tag	gta	wordstat_top_queries (1).csv
промт фото девушки с кошкой	21	/promty-dlya-foto-devushki/s-kotom/	programmatic_L2	audience_tag+object_tag	devushka+s_kotom	wordstat_top_queries (1).csv
промт для нейросети фото со знаменитостью	20	/so-znamenitostyu/	programmatic_L1	object_tag	so_znamenitostyu	wordstat_top_queries (1).csv
интересные промты для фото девушки	20	/promty-dlya-foto-devushki/	programmatic_L1	audience_tag	devushka	wordstat_top_queries (1).csv
промт для фото сына и матери	20	/promty-dlya-foto-s-mamoy/	programmatic_L1	audience_tag	s_mamoy	wordstat_top_queries (1).csv
промты бесплатно фото девушки	20	/promty-dlya-foto-devushki/	programmatic_L1	audience_tag	devushka	wordstat_top_queries (1).csv
промт фото мужчины с бородой	20	/promty-dlya-foto-muzhchiny/	programmatic_L1	audience_tag	muzhchina	wordstat_top_queries (1).csv
промт для ии фото для двоих	20	/promty-dlya-foto-par/	programmatic_L1	audience_tag	para	wordstat_top_queries (1).csv
промты для нейросети для обработки фото детские	20	/promty-dlya-detskih-foto/	programmatic_L1	audience_tag	detskie	wordstat_top_queries (1).csv
промт для создания фото с путиным	20	/so-znamenitostyu/	programmatic_L1	object_tag	so_znamenitostyu	wordstat_top_queries (1).csv
промты для ии фото с животными	20	/promty-dlya-foto-s-pitomcem/	programmatic_L1	audience_tag	s_pitomcem	wordstat_top_queries (1).csv
промт для фото девушка с короной	20	/promty-dlya-foto-devushki/s-koronoj/	programmatic_L2	audience_tag+object_tag	devushka+s_koronoy	wordstat_top_queries (1).csv
промт для ии фото с кошкой	20	/s-kotom/	programmatic_L1	object_tag	s_kotom	wordstat_top_queries (1).csv
промт на коллаж из трех фото	20	/stil/kollazh/	programmatic_L1	style_tag	kollazh	wordstat_top_queries (1).csv
промт для генерации фото для резюме	20	/foto-na-rezume/	programmatic_L1	doc_task_tag	na_rezume	wordstat_top_queries (1).csv
промт для фото двух сестер	20	/promty-dlya-foto-s-sestroy/	programmatic_L1	audience_tag	s_sestroy	wordstat_top_queries (1).csv
готовые промты для фото с машиной	20	/s-mashinoy/	programmatic_L1	object_tag	s_mashinoy	wordstat_top_queries (1).csv
промт для совместного фото с девушкой	20	/promty-dlya-foto-devushki/	programmatic_L1	audience_tag	devushka	wordstat_top_queries (1).csv
нейросеть для редактирования фото по промту	20	/promty-dlya-obrabotki-foto/	static_hub	intent_action=obrabotka	intent_action=obrabotka	wordstat_top_queries (1).csv
промты для чат гпт фото с машиной	20	/s-mashinoy/	programmatic_L1	object_tag	s_mashinoy	wordstat_top_queries (1).csv
промт для фото мужского дня рождения	20	/promty-dlya-foto-muzhchiny/	programmatic_L1	audience_tag	muzhchina	wordstat_top_queries (1).csv
промт для фотосессии фото поколений	20	/promty-dlya-foto-pokoleniy/	programmatic_L1	audience_tag	pokoleniy	wordstat_top_queries (1).csv
промт для создания раскраски из фото	20	/promty-dlya-sozdaniya-foto/	static_hub	intent_action=sozdanie	intent_action=sozdanie	wordstat_top_queries (1).csv
промты фото зимняя фотосессия	20	/zimnie/	programmatic_L1	object_tag	zima	wordstat_top_queries (1).csv
промт на фото ребенка к 8 марта	20	/promty-dlya-detskih-foto/8-marta/	programmatic_L2	audience_tag+occasion_tag	detskie+8_marta	wordstat_top_queries (1).csv
