new_landing_url	menu_group	category	subcategory	page_level	query_count	total_volume	sample_query_1	sample_query_2	sample_query_3	sample_query_4	sample_query_5
/promty-dlya-sozdaniya-foto/	Сценарии	Создание фото	Общие	L1	112	34317	промт для создания фото	промт для генерации фото	промт для ии для создания фото	сделать фото ии промт	промты для генерации изображений по фото
/promty-dlya-foto-devushki/	Люди и отношения	Девушки	Общие	L1	55	17398	промты для фото девушки	промты для фото женщины	промты для фото женские	промты фото девушек нейросетей	промты для ии для фото девушки
/promty-dlya-obrabotki-foto/	Сценарии	Обработка фото	Общие	L1	69	14688	промт для обработки фото	промты для нейросети для обработки фото	промты для изменения фото	промт для редактирования фото	промт для ии для обработки фото
/promty-dlya-foto-par/	Люди и отношения	Пары	Общие	L1	40	9078	промты для фото пар	промты для парных фото	промты для совместных фото	промт ии парное фото фото	фото для пар ии промты
/promty-dlya-foto-muzhchiny/	Люди и отношения	Мужчины	Общие	L1	40	8253	промты для фото мужчины	промт для фото мужской	промт для ии фото мужчины	промты для фото ии мужские	промт для создания фото мужчины
/promty-dlya-detskih-foto/	Люди и отношения	Дети	Общие	L1	29	5266	промты для детских фото	промт для фото с ребенком	промт для фото мамы с ребенком	промты для детских фото ии	промт фото фоне детского фото
/promty-dlya-semejnogo-foto/	Люди и отношения	Семья	Общие	L1	32	5084	промт для семейного фото	промт для фото семьи	промт для ии семейное фото	промт для создания семейного фото	промт для нейросети семейное фото
/promty-dlya-uluchsheniya-foto/	Сценарии	Улучшение фото	Общие	L1	12	5034	промт для улучшения фото	промт для улучшения качества фото	промт улучшить фото	промт чтобы улучшить качество фото	промт для нейросети для улучшения фото
/	Главная	Главная	Из фото в промт	home	12	4450	создать промт по фото	сделать промт по фото	создать промт по фото бесплатно	создать промт по фото онлайн	генератор промтов по фото
/sobytiya/den-rozhdeniya/	События	День рождения	Общие	L1	9	3193	промт для фото на день рождения	промт для ии фото на день рождения	промт для создания фото на день рождения	промт для фото на др	промт для фото нейросети на день рождения
/stil/cherno-beloe/	Стили	Черно-белое	Общие	L1	13	3140	промт черно белое фото	промт на чб фото	черно белое фото ии промт	промт черно белое фото пары	промт для создания черно белого фото
/instrumenty/chatgpt/	Инструменты	ChatGPT	Общие	L1	30	3077	промт для gpt обработка фото	промт для чата gpt на создание фото	промты для чата gpt для обработки фото	промт для обработки фото chatgpt	промты для создания фото в gpt
/promty-dlya-restavracii-foto/	Сценарии	Реставрация фото	Общие	L1	14	2581	промт для старых фото	промт для реставрации фото	промт для восстановления фото	промт для реставрации старых фото	промт для восстановления старых фото
/stil/realistichnoe/	Стили	Реалистичное	Общие	L1	12	2525	реалистичные промты для фото	промт для создания реалистичного фото	промты для ии для реалистичных фото	промты для максимально реалистичных фото	реалистичное фото промт с описанием
/promty-dlya-foto-s-mamoy/	Люди и отношения	С мамой	Общие	L1	21	2504	промт для фото с мамой	промт для фото мамы и сына	промт для фото мама и дочь	промты для фото мамы с дочкой	промты для ии фото с мамой
/foto-na-pasport/	Задачи	На паспорт	Общие	L1	14	2403	промт для фото на паспорт	промт для ии фото на паспорт	промт для создания фото на паспорт	промт чтобы сделать фото на паспорт	промт для нейросети фото на паспорт
/sobytiya/23-fevralya/	События	23 февраля	Общие	L1	7	2350	промт для фото на 23 февраля	ии промты для фото 23 февраля	промт для создания фото на 23 февраля	промт для фото поздравления с 23 февраля	промт для фото день защитника отечества
/stil/portret/	Стили	Портрет	Общие	L1	11	2166	промт для фото портрета	промт для портретного фото	промт для ии фото портрет	промт студийное фото портрет	промты для генерации фото портрет
/v-forme/	Сцены и объекты	В форме	Общие	L1	17	2125	промт для фото с военным	промт для фото в форме	промт для фото в военной форме	промт для фото сво	промт для нейросети военный для фото
/so-znamenitostyu/	Сцены и объекты	Со знаменитостью	Общие	L1	41	2068	промт для фото со знаменитостью	промт для фото с путиным	промт для фото со звездой	промт для фото с знаменитостью	промт для создания фото со знаменитостью
/s-mashinoy/	Сцены и объекты	С машиной	Общие	L1	18	2042	промты для фото с машиной	промт для фото автомобиля	промт для фото авто	промт для создания фото с машиной	промт для генерации фото с машиной
/stil/love-is/	Стили	Love Is	Общие	L1	21	1920	промт для фото love is	промт для фото в стиле love is	промт для фото лав ис	промт для фото лов ис	промт для фото лав из
/promty-dlya-sozdaniya-foto/podrobnye/	Сценарии	Создание фото	Подробные промты	L2	8	1674	подробный промт для генерации фото	подробный промт для создания фото	детальный промт для генерации похожего фото	подробный промт для генерации фото в нейросети	подробный промт для генерации изображения по фото
/stil/gta/	Стили	GTA	Общие	L1	17	1658	промт для фото в стиле гта	промт на фото гта	промт для ии фото гта	промт для создания фото в стиле гта	промт для фото в стиле гта 5
/s-cvetami/	Сцены и объекты	С цветами	Общие	L1	13	1655	промт для фото с цветами	промт для фото с букетом	промт для фото с тюльпанами	промт для создания фото с цветами	промт для фото с букетом цветов
/promty-dlya-fotosessii/	Сценарии	Фотосессия	Общие	L1	7	1646	промт для фото фотосессия	промты для генерации фото фотосессии	промт для фото в стиле фотосессии	промты для ии фотосессии с фото	промт фото для пары фотосессия
/stil/studiynoe/	Стили	Студийное	Общие	L1	12	1631	промт для студийного фото	промт для фото в студии	промт для создания студийного фото	промт для фото ии студийное	промт для создания фото в студии
/promty-dlya-foto-s-parnem/	Люди и отношения	С парнем	Общие	L1	7	1570	промт для фото с парнем	промты для ии фото с парнем	промт для генерации фото с парнем	промт для создания фото с парнем	промт на фото в машине с парнем
/promty-dlya-foto-pokoleniy/	Люди и отношения	Поколения	Общие	L1	11	1377	промт для фото поколений	промт для создания фото поколений	фото поколений на черном фоне промт	промт для ии фото поколений	промт для нейросети фото поколений
/stil/delovoe/	Стили	Деловое	Общие	L1	11	1373	промт для делового фото	промт для фото в деловом стиле	промт для офисного фото	промт для создания делового фото	промт для ии деловое фото
/promty-dlya-sozdaniya-foto/primery/	Сценарии	Создание фото	Примеры промтов	L2	8	1347	промт для генерации фото примеры	промт для создания фото примеры	пример промта для создания похожего фото	пример промта для генерации похожего фото	примеры промтов для создания фото в нейросети
/promty-dlya-kollazha/	Сценарии	Коллаж	Общие	L1	10	1267	промт на объединение фото	промт объединить фото	промт для объединения людей на фото	промт для соединения фото	промт для соединения двух фото
/promty-dlya-foto-s-drugom/	Люди и отношения	С другом	Общие	L1	2	1266	промт фото друзья	промты для фото с другом			
/sobytiya/14-fevralya/	События	14 февраля	Общие	L1	11	1238	промт для фото на 14 февраля	промт для фото на день святого валентина	промт для фото валентинки	промт для фото в стиле 14 февраля	промт для фото пары на 14 февраля
/promty-dlya-obrabotki-foto/gotovye/	Сценарии	Обработка фото	Готовые промты	L2	3	1126	готовые промты для обработки фото	промты для нейросети для обработки фото готовые	готовые промты для редактирования фото		
/stil/retro/	Стили	Ретро	Общие	L1	9	1053	ретро фото промт	винтажное фото промт	промт для фото в ретро стиле	промт для создания ретро фото	промт для фото 90х
/promty-dlya-foto-s-papoy/	Люди и отношения	С папой	Общие	L1	12	1029	промт для фото с папой	промт для фото с отцом	промт фото отца и дочери	промт для фото папа и сын	ии промт фото с папой
/promty-dlya-foto-devochki/	Люди и отношения	Девочки	Общие	L1	5	991	промт для фото девочки	промты для ии для фото девочки	промт для фото девочки подростка	промт для фото нейросети для девочки	промт фото девочки 13 лет
/stil/otkrytka/	Стили	Открытка	Общие	L1	9	950	промт фото в стиле открытки	промт для открытки из фото	промт для фото советская открытка	промт для создания открытки по фото	промты для ии фото открытки
/stil/sovetskoe/	Стили	Советское	Общие	L1	8	936	советское фото промт	промт фото ссср	промт для фото в советском стиле	промт для фото в стиле ссср	промт для ии советское фото
/promty-dlya-sozdaniya-foto/gotovye/	Сценарии	Создание фото	Готовые промты	L2	8	928	готовые промты для генерации фото	готовые промты для создания фото	готовые промты для создания фото ии	готовые промты для генерации фото в нейросети	готовые промты для генерации фото ии
/sobytiya/8-marta/	События	8 марта	Общие	L1	4	919	промт для фото на 8 марта	промт для создания фото на 8 марта	промт для генерации фото к 8 марта	промт на фото подруг на 8 марта	
/vesennie/	Сцены и объекты	Весна	Общие	L1	6	866	промт для весеннего фото	промт для фото весна	промт для весеннего фото для ии	промт для создания весеннего фото	промт для нейросети фото весенние
/v-kostyume/	Сцены и объекты	В костюме	Общие	L1	3	862	промт для фото в костюме	промт для создания фото в костюме	промт для фото в пиджаке		
/zimnie/	Сцены и объекты	Зима	Общие	L1	23	861	промт на зимнее фото	промт для фото в зимнем лесу	промт фото в снегу	промт для создания зимних фото	промт для генерации зимнего фото
/sobytiya/maslenica/	События	Масленица	Общие	L1	7	857	промт для фото на масленицу	промт для фото в стиле масленицы	промты для фото ии на масленицу	промт для создания фото на масленицу	промт для фото нейросети масленица
/sobytiya/svadba/	События	Свадьба	Общие	L1	14	827	промт для свадебного фото	промт для фото свадьбы	промт для свадебного фото ии	промт для фото в свадебном платье	промт для создания свадебного фото
/promty-dlya-foto-s-pitomcem/	Люди и отношения	С питомцем	Общие	L1	10	825	промт для фото с питомцем	промт для фото с животными	промт для ии фото с питомцем	промт для создания фото с питомцем	промт для генерации фото с питомцем
/promty-dlya-foto-vlyublennykh/	Люди и отношения	Влюбленные	Общие	L1	8	786	промт для фото влюбленных	промт для фото влюбленной пары	промт для фото влюбленный взгляд	промты для создания фото влюбленных	промт для нейросети фото влюбленных
/s-kotom/	Сцены и объекты	С котом	Общие	L1	10	767	промт для фото с котом	промт для фото с кошкой	промт для фото в кокошнике	промт фото ии с котом	промт для создания фото с котом
/promty-dlya-foto-s-podrugoy/	Люди и отношения	С подругой	Общие	L1	5	725	промт для фото с подругой	промт для ии фото с подругой	промт для фото нейросети с подругой	промт для создания фото с подругой	промт фото с подругой с бутылкой шампанского
/promty-dlya-foto-malchika/	Люди и отношения	Мальчики	Общие	L1	5	701	промты для фото мальчика	промт для фото подростка мальчика	промт для обработки фото мальчика	промт для фото ии мальчика робота	промты для ии фото мальчика 12 лет
/promty-dlya-foto-s-dochkoy/	Люди и отношения	С дочкой	Общие	L1	3	695	промт фото с дочерью	промт для фото с дочкой	промт для ии фото с дочкой		
/promty-dlya-foto-s-muzhem/	Люди и отношения	С мужем	Общие	L1	4	681	промты для фото с мужем	промт для ии фото с мужем	промт для создания фото с мужем	промты для нейросети фото с мужем	
/s-sobakoj/	Сцены и объекты	С собакой	Общие	L1	7	679	промт для фото с собакой	промт для ии фото с собакой	промт для создания фото с собакой	промт для фото с доберманом	промт для нейросети фото с собакой
/promty-dlya-obrabotki-foto/primery/	Сценарии	Обработка фото	Примеры промтов	L2	3	648	промт для обработки фото примеры	промты для нейросети для обработки фото примеры	промт для редактирования фото примеры		
/s-tortom/	Сцены и объекты	С тортом	Общие	L1	3	635	промт на фото с тортом	промт для создания фото с тортом	промт для фото нейросети торта		
/v-profil/	Сцены и объекты	В профиль	Общие	L1	4	631	промт для фото в профиль	промт для ии фото в профиль	промты для фото в профиль лица	промт для фото в профиль 3 человек	
/promty-dlya-foto-s-babushkoy/	Люди и отношения	С бабушкой	Общие	L1	5	621	промт для фото бабушки	промт для фото бабушки с внуками	промт для фото бабушки и дедушки	промт для фото бабушки и внучки	промт для фото дедушки с внуками
/promty-dlya-detskih-foto/den-rozhdeniya/	Люди и отношения	Дети	День рождения	L2	3	589	промт на день рождения с детским фото	промт день рождения на фоне детское фото	промт для фото на день рождения ребенка		
/foto-na-dokumenty/	Задачи	На документы	Общие	L1	8	565	промт для фото на документы	промт для создания фото на документы	промт для фото на удостоверение	фото на документы ии промт	промт чтобы сделать фото на документы
/v-zerkale/	Сцены и объекты	В зеркале	Общие	L1	3	549	промт для фото в зеркале	промт для ии фото в зеркале	промт для фото машины в зеркале		
/stil/anime/	Стили	Аниме	Общие	L1	6	472	промт для аниме фото	промт для фото в стиле аниме	промт для генерации фото в стиле аниме	промты для ии фото аниме	промт для изменения фото в стиле аниме
/stil/polaroid/	Стили	Полароид	Общие	L1	7	471	промт для фото полароид	промт для создания фото полароид	промт для ии фото на полароид	промт для фото в стиле полароид	промт для нейросети фото полароид
/foto-na-avatarku/	Задачи	На аватарку	Общие	L1	6	451	промт для фото на аватарку	промт для создания аватарки по фото	промт для фото на аву	промт для фото на аватар	промт фото ии для аватарки
/stil/multyashnoe/	Стили	Мультяшное	Общие	L1	7	441	промт на мультяшное фото	промт для фото в мультяшном стиле	промт чтобы сделать фото мультяшным	промт для фото в стиле мультика	промт для gpt мультяшные фото
/promty-dlya-foto-malysha/	Люди и отношения	Малыши	Общие	L1	7	413	промты для фото малышей	промт для фото новорожденного	промты на фото младенца	промт для фото по месяцам малышу	промт для создания фото новорожденного
/promty-dlya-sozdaniya-foto/krasivye/	Сценарии	Создание фото	Красивые промты	L2	5	407	промт для создания красивого фото	промт для генерации красивого фото	интересные промты для генерации фото	промт для создания красивых фото в ии	промт на создание фото с красивым телом
/promty-dlya-semejnogo-foto/v-profil/	Люди и отношения	Семья	В профиль	L2	5	385	промт для семейного фото в профиль	промт для фото семьи в профиль	промт для создания семейного фото в профиль	промт на фото семью боком	промт для семейного фото боком
/promty-dlya-foto-s-synom/	Люди и отношения	С сыном	Общие	L1	1	384	промт для фото с сыном				
/na-more/	Сцены и объекты	На море	Общие	L1	4	331	промт фото на море	промт для фото на пляже	промт фото на байкале	промт для фото на мальдивах	
/promty-dlya-sozdaniya-foto/na-russkom/	Сценарии	Создание фото	Промты на русском	L2	1	323	промт для генерации фото на русском				
/promty-dlya-foto-devushki/cherno-beloe/	Люди и отношения	Девушки	Черно-белое	L2	2	312	промт черно белое фото девушки	промт черно белое фото женщины			
/promty-dlya-foto-devushki/den-rozhdeniya/	Люди и отношения	Девушки	День рождения	L2	1	273	промт для фото на день рождения девушке				
/stil/selfi/	Стили	Селфи	Общие	L1	1	263	промты для фото селфи				
/v-lesu/	Сцены и объекты	В лесу	Общие	L1	1	257	промт для фото в лесу				
/promty-dlya-foto-podrostka/	Люди и отношения	Подростки	Общие	L1	3	256	промт для фото подростка	промт для фото ии подростка	промты для генерации фото подростка		
/foto-na-rezume/	Задачи	Для резюме	Общие	L1	5	255	промт для фото на резюме	промт для создания фото для резюме	промт для ии фото для резюме	промт для генерации фото для резюме	промт для фото нейросети для резюме
